group,score,keyword,sourceUrl,sourceTitle,destinationUrl,snippet,gscImpressions,gscClicks,gscPosition,status,notes
"","7","garden shed","https://www.buyshedsdirect.co.uk/blog/post/spend-and-save-on-forest-garden-sheds","Spend & Save on Forest Garden Sheds | Buy Sheds Direct","https://www.buyshedsdirect.co.uk/sheds","Spend & Save on Forest Garden Sheds Posted: February 05, 2026 Categories: , Author: The Buy Sheds Direc…","","","","Opportunity found",""
"","7","garden shed","https://www.buyshedsdirect.co.uk/blog/post/2025-round-up-your-favourite-garden-products","Your 2025 Favourite Garden Products | Buy Sheds Direct","https://www.buyshedsdirect.co.uk/sheds","…en ShedAnother top choice for pent roof fans in 2025 was the . This traditional garden shed may look a little unassuming on the surface, but there are a few key…","","","","Opportunity found",""
"","7","garden shed","https://www.buyshedsdirect.co.uk/blog/category/shed-advice?page=5","Page 5 - Shed Advice Blog Posts","https://www.buyshedsdirect.co.uk/sheds","…es: , Author: The Buy Sheds Direct Team Shed accessories can transform a normal garden shed into a great one. Discover the best shed accessories here, including…","","","","Opportunity found",""
"","7","garden shed","https://www.buyshedsdirect.co.uk/blog/category/news-interviews-and-competitions?page=5","Page 5 - News, Interviews and Competitions | Blog","https://www.buyshedsdirect.co.uk/sheds","…Author: The Buy Sheds Direct Team With two thirds of adults in the UK owning a garden shed, it was only a matter of time before there was a prize for the best!…","","","","Opportunity found",""
"","7","garden shed","https://www.buyshedsdirect.co.uk/blog/post/how-to-insulate-a-summer-house-ventilation-tips","How to Insulate a Summer House | Ventilation Tips, Air Vents & DIY Guide","https://www.buyshedsdirect.co.uk/sheds","…nging, or even napping inside much more pleasant. Insulating a summer house and garden sheds offers many benefits, such as improved comfort, protection from dam…","","","","Opportunity found",""
"","7","garden shed","https://www.buyshedsdirect.co.uk/blog/post/best-plastic-shed-advantages","How to Choose the Best Plastic Shed | 10 Advantages of Plastic Sheds","https://www.buyshedsdirect.co.uk/sheds","…Plastic Shed (1.85m x 0.9m) - Click Image to View7' x 9' Keter Premier Plastic Garden Shed (2.28m x 2.87m) - Click Image to View11' x 9' Palram Canopia Yukon P…","","","","Opportunity found",""
"","7","garden shed","https://www.buyshedsdirect.co.uk/blog/post/resin-vs-vinyl-vs-plastic-shed-materials-what-is-the-difference","Vinyl vs Plastic Shed Comparison | Resin, Vinyl & Plastic Shed Materials","https://www.buyshedsdirect.co.uk/sheds","…to consider from the Buy Sheds Direct collection:1) Keter 8’x6’ Factor Plastic Garden Shed8' x 6' Keter Factor Plastic Garden Shed (2.57m x 1.82m) - Click Imag…","","","","Opportunity found",""
"","7","garden shed","https://www.buyshedsdirect.co.uk/blog/post/maximising-urban-gardens-vertical-container-gardening-solutions-small-spaces","Maximising Urban Gardens | Vertical & Container Gardening Solutions for Small Spaces","https://www.buyshedsdirect.co.uk/sheds","…ving option for tight spaces and is ideal for outdoor seating and entertainment Garden sheds - designed for storage, you can optimally declutter your small spac…","","","","Opportunity found",""
"","7","garden shed","https://www.buyshedsdirect.co.uk/blog/post/storage-ideas-to-organise-your-garden","Storage ideas to organise your garden | Blog | Buy Sheds Direct","https://www.buyshedsdirect.co.uk/sheds","…ke a bit more information on the range then take a look at our video below: The garden shed Little comes close to the efficiency of a garden shed, but again the…","","","","Opportunity found",""
"","7","garden shed","https://www.buyshedsdirect.co.uk/blog/post/3-superb-reasons-why-your-next-garden-shed-should-be-a-4life-modular-shed","Why Your Next Shed Should Be A 4Life Modular Shed | BSD Blog","https://www.buyshedsdirect.co.uk/sheds","3 Superb Reasons Why Your Next Garden Shed Should Be A 4Life Modular Shed Posted: April 20, 2023 Categories: Au…","","","","Opportunity found",""
"","7","garden shed","https://www.buyshedsdirect.co.uk/blog/post/customer-showcase-will-s-garden","Customer showcase - Will's garden - Buy Sheds Direct","https://www.buyshedsdirect.co.uk/sheds","…hey’re being used for. As we’ve seen previously on Shed of the Year, the humble garden shed can be used for so many different purposes – from practical to just…","","","","Opportunity found",""
"","7","garden shed","https://www.buyshedsdirect.co.uk/blog/post/shed-of-the-year-2016-episode-four","Shed of the Year 2016: Episode Four - Buy Sheds Direct","https://www.buyshedsdirect.co.uk/sheds","…extremely creative this year retired carpenter Brian is back with an enchanting garden shed constructed on a shoestring – The ‘’. Budding artist Brian has creat…","","","","Opportunity found",""
"","7","garden shed","https://www.buyshedsdirect.co.uk/blog/post/new-years-resolution","New Year's resolution! - Buy Sheds Direct","https://www.buyshedsdirect.co.uk/sheds","…ber 20, 2013 Categories: Author: The Buy Sheds Direct Team For many people, the garden shed will need sorting out in the New Year. Over the winter we tend to fo…","","","","Opportunity found",""
"","7","garden shed","https://www.buyshedsdirect.co.uk/blog/post/gold-for-bradley-wiggins-owes-his-victory-to-time-spent-in-his-garden-shed","Gold for Bradley Wiggins | Buy Sheds Direct","https://www.buyshedsdirect.co.uk/sheds","Gold for Bradley Wiggins – owes his victory to time spent in his garden shed Posted: August 06, 2012 Categories: Author: The Buy Sheds Direct Tea…","","","","Opportunity found",""
"","6","garden shed","https://www.buyshedsdirect.co.uk/blog/category/shed-advice","Shed Advice Blog Posts","https://www.buyshedsdirect.co.uk/sheds","…uary 20, 2026 Categories: , Author: The Buy Sheds Direct Team Looking for a new garden shed? There’s a lot to love about the Palram Canopia Skylight plastic she…","","","","Linked to different URL",""
"","6","garden shed","https://www.buyshedsdirect.co.uk/blog/category/sheds","Sheds | Garden Sheds | Blogs","https://www.buyshedsdirect.co.uk/sheds","…uary 20, 2026 Categories: , Author: The Buy Sheds Direct Team Looking for a new garden shed? There’s a lot to love about the Palram Canopia Skylight plastic she…","","","","Linked to different URL",""
"","6","garden shed","https://www.buyshedsdirect.co.uk/blog/category/news-interviews-and-competitions","News, Interviews and Competitions | Blog","https://www.buyshedsdirect.co.uk/sheds","…mited time only, get great savings on all 4Life, Beckwood and Timberdale wooden garden sheds from Forest Garden with our voucher codes. Posted: January 15, 2026…","","","","Linked to different URL",""
"","6","garden shed","https://www.buyshedsdirect.co.uk/blog/post/she-shed-ideas-designs","10 Best She Shed Ideas & Designs for Your Garden | Ideas for a She Shed","https://www.buyshedsdirect.co.uk/sheds","…alphabetically. Good lighting is necessary here, so strategically position your garden shed to maximise sunlight exposure. It is also crucial to ensure you have…","","","","Opportunity found",""
"","6","garden shed","https://www.buyshedsdirect.co.uk/blog?page=3","Page 3 - The Buy Sheds Direct Blog","https://www.buyshedsdirect.co.uk/sheds","…m Find the best type of shed for your garden. Compare wooden, metal and plastic garden sheds to make the right choice based on durability, budget and maintenanc…","","","","Linked to different URL",""
"","6","garden shed","https://www.buyshedsdirect.co.uk/blog/post/types-of-shed","Types of Shed | Wood, Metal or Plastic? Choosing The Best Shed Styles","https://www.buyshedsdirect.co.uk/sheds","…ng guide.The three main types of shed (by material)The three main shed types of garden sheds by material include wooden, metal and plastic (or resin). Most shed…","","","","Weak anchor",""
"","6","garden shed","https://www.buyshedsdirect.co.uk/blog/category/shed-advice?page=4","Page 4 - Shed Advice Blog Posts","https://www.buyshedsdirect.co.uk/sheds","…: November 22, 2024 Categories: , Author: The Buy Sheds Direct Team Looking for garden shed workshop ideas? Learn how to convert your shed into a functional wor…","","","","Linked to different URL",""
"","6","garden shed","https://www.buyshedsdirect.co.uk/blog/post/high-security-garden-sheds-reviewed","High Security Garden Sheds | Top 5 Most Secure Sheds | Buy Sheds Direct","https://www.buyshedsdirect.co.uk/sheds","High Security Garden Sheds, Ideas & Tips: Top 5 Most Secure Sheds Reviewed [UPDATED] Posted: N…","","","","Linked to different URL",""
"","6","garden shed","https://www.buyshedsdirect.co.uk/blog/category/sheds?page=5","Page 5 - Sheds | Garden Sheds | Blogs","https://www.buyshedsdirect.co.uk/sheds","…, 2024 Categories: Author: The Buy Sheds Direct Team Painting and treating your garden sheds are an annual activity for most shed owners. Painting your garden s…","","","","Linked to different URL",""
"","6","garden shed","https://www.buyshedsdirect.co.uk/blog/post/best-garden-sheds-to-buy","Best Garden Sheds of 2024: Good-Quality, Recommended Sheds to Buy","https://www.buyshedsdirect.co.uk/sheds","Best Garden Sheds of 2024: From Rustic to Modern, Discover our Recommended Sheds to B…","","","","Weak anchor",""
"","6","garden shed","https://www.buyshedsdirect.co.uk/blog/post/which-is-the-best-garden-building-for-me","Which is the Best Garden Building or Garden Room for Me? | Complete Guide","https://www.buyshedsdirect.co.uk/sheds","…, heating and internet connectivity, and is designed for year-round use. 1) The Garden ShedIf you were to say the words ‘garden building’ to someone, chances ar…","","","","Weak anchor",""
"","6","garden shed","https://www.buyshedsdirect.co.uk/blog/post/hide-wheelie-bin-storage-ideas","Wheelie Bin Storage Ideas | Ideas to Disguise, Conceal or Hide Wheelie Bins","https://www.buyshedsdirect.co.uk/sheds","…bin visibility problem, provides privacy and is aesthetically pleasing.Inside a garden shedStoring your wheelie bins inside a garden shed is the best way to kee…","","","","Weak anchor",""
"","6","garden shed","https://www.buyshedsdirect.co.uk/blog/category/garden-storage?page=4","Page 4 - Garden Storage | Outdoor Storage | Blogs","https://www.buyshedsdirect.co.uk/sheds","…arden storage solution can be a task in itself. If you've out grown your humble garden shed, you might want to consider a smaller or Posted: January 12, 2017 Ca…","","","","Opportunity found",""
"","6","garden shed","https://www.buyshedsdirect.co.uk/blog/post/how-to-beef-up-garden-shed-security","Security for Sheds | Learn How to Beef Up Your Garden Shed Security","https://www.buyshedsdirect.co.uk/sheds","Security For Sheds: Learn How to Beef Up Your Garden Shed Security Properly [UPDATED] Posted: October 31, 2025 Categories: Aut…","","","","Weak anchor",""
"","6","garden shed","https://www.buyshedsdirect.co.uk/blog/post/meet-our-suppliers-yardmaster","Meet Our Suppliers: Yardmaster | Buy Sheds Direct","https://www.buyshedsdirect.co.uk/sheds","…mporary metallic-silver finish and 10-year anti-rust guarantee and you’ve got a garden shed that will happily grow old with you.Equally as elegant is the . A ho…","","","","Opportunity found",""
"","6","garden shed","https://www.buyshedsdirect.co.uk/blog/post/how-to-build-a-shed-base-with-concrete-blocks","How to Build a Concrete Shed Foundation with Blocks or Slabs","https://www.buyshedsdirect.co.uk/sheds","…p proof membrane. This helps to prevent water from working its way up into your garden shed from beneath. Simply add a sheet of damp proof weed membrane meeting…","","","","Weak anchor",""
"","6","garden shed","https://www.buyshedsdirect.co.uk/blog/post/meet-our-suppliers-palram-canopia","Meet Our Suppliers: Palram Canopia | Buy Sheds Direct","https://www.buyshedsdirect.co.uk/sheds","…here are hundreds of amazing options to consider. If you’re in the market for a garden shed, then you’ll love the fact that we’re currently offering up to 39% o…","","","","Opportunity found",""
"","6","garden shed","https://www.buyshedsdirect.co.uk/blog/category/log-cabins?page=4","Page 4 - Log Cabins | Garden Buildings | Blogs","https://www.buyshedsdirect.co.uk/sheds","…ing permission”? Usually, this is aimed at our log cabins, sometimes our larger garden sheds and, in one memorable conversation, at our compost bins… With the c…","","","","Opportunity found",""
"","6","garden shed","https://www.buyshedsdirect.co.uk/blog/post/types-of-shed","Types of Shed | Wood, Metal or Plastic? Choosing The Best Shed Styles","https://www.buyshedsdirect.co.uk/sheds","…ng guide.The three main types of shed (by material)The three main shed types of garden sheds by material include wooden, metal and plastic (or resin). Most shed…","","","","Weak anchor",""
"","6","garden shed","https://www.buyshedsdirect.co.uk/blog/post/wooden-shed-designs-and-design-plans","Wooden Shed Designs & Design Plans | Roof & Shape Options | Buy Sheds Direct","https://www.buyshedsdirect.co.uk/sheds","…provides. Here are the most popular wooden shed designs and their benefits.Apex garden sheds feature a traditional peaked design that grants additional vertical…","","","","Weak anchor",""
"","6","garden shed","https://www.buyshedsdirect.co.uk/blog/post/how-to-build-a-shed","How to Build a Shed | A Shed-Building Guide From Buy Sheds Direct","https://www.buyshedsdirect.co.uk/sheds","…u’ve got to choose the right shed to suit your requirements. Choosing the right garden shed is a key decision that impacts how you use your . The popular choice…","","","","Weak anchor",""
"","6","garden shed","https://www.buyshedsdirect.co.uk/blog/post/cheap-shed-ideas-and-the-best-value-plastic-sheds","Cheap Shed Ideas | Best-Value Plastic Sheds & Garden Storage","https://www.buyshedsdirect.co.uk/sheds","…when it comes to practical plastic sheds and garden storage.Never compromise on garden shed qualityBrowsing our carefully curated range of best-value plastic sh…","","","","Weak anchor",""
"","6","garden shed","https://www.buyshedsdirect.co.uk/blog/post/how-to-felt-a-shed-roof","How To Felt a Shed Roof | Guide to Laying Felt on a Flat or Sloped Roof","https://www.buyshedsdirect.co.uk/sheds","…eatment 5ltr Harvest Gold - Click Image to ViewChoosing the right felt for your garden shedConsider the size and type of your shed, and the local weather condit…","","","","Opportunity found",""
"","6","garden shed","https://www.buyshedsdirect.co.uk/blog/post/shed-painting-ideas-paint-colours-for-sheds","Shed Painting Ideas | The Best Paint Colours for Sheds | Themed Shed","https://www.buyshedsdirect.co.uk/sheds","…transform the inside too. A painted shed does not just improve the look of your garden sheds; it is also a focal point, which adds personality and style to your…","","","","Weak anchor",""
"","6","garden shed","https://www.buyshedsdirect.co.uk/blog/post/garden-shed-workshop-ideas-layout","Garden Shed Workshop Ideas | Shed-to-Workshop Guide & Layout","https://www.buyshedsdirect.co.uk/sheds","Garden Shed Workshop Ideas: A Guide to Turning Your Shed into a Garden Workshop…","","","","Weak anchor",""
"","6","garden shed","https://www.buyshedsdirect.co.uk/blog/post/constructing-a-shed-how-long-does-it-take-to-put-up","How Long Does It Take To Put Up a Shed? | Constructing a Shed & Assembly","https://www.buyshedsdirect.co.uk/sheds","…preparation Proper preparation is an important step in a smooth and successful garden shed assembly. A prepared site saves time and reduces hassle, your will b…","","","","Weak anchor",""
"","6","garden shed","https://www.buyshedsdirect.co.uk/blog/post/how-to-install-a-shed-base-on-grass","How to Install a Shed Base on Grass | The Best Base for a Garden Shed","https://www.buyshedsdirect.co.uk/sheds","…all a Shed Base on Grass? Avoid Costly Mistakes by Choosing the Best Base for a Garden Shed Posted: October 17, 2024 Categories: , Author: The Buy Sheds Direct…","","","","Weak anchor",""
"","6","garden shed","https://www.buyshedsdirect.co.uk/blog/post/high-security-garden-sheds-reviewed","High Security Garden Sheds | Top 5 Most Secure Sheds | Buy Sheds Direct","https://www.buyshedsdirect.co.uk/sheds","High Security Garden Sheds, Ideas & Tips: Top 5 Most Secure Sheds Reviewed [UPDATED] Posted: N…","","","","Linked to different URL",""
"","6","garden shed","https://www.buyshedsdirect.co.uk/blog/post/the-top-5-reasons-to-buy-a-metal-shed-and-which-ones-you-should-choose","Why Buy a Metal Shed & Which to Choose? | Buy Sheds Direct","https://www.buyshedsdirect.co.uk/sheds","…totally insect proof, completely fire retardant and rust-resistant too. A metal garden shed will cope with all of life’s eventualities. The is a case in point.…","","","","Linked to different URL",""
"","6","garden shed","https://www.buyshedsdirect.co.uk/blog/post/how-to-turn-shed-into-gym-ideas","How to Turn a Shed into a Gym | Amazing Shed Gym Ideas","https://www.buyshedsdirect.co.uk/sheds","…. Editor’s Note [20.10.25]: The original post of ideas for creating the perfect garden shed gym was first published in January 2018. Our December 2023 upgrade w…","","","","Weak anchor",""
"","6","garden shed","https://www.buyshedsdirect.co.uk/blog/category/sheds?page=6","Page 6 - Sheds | Garden Sheds | Blogs","https://www.buyshedsdirect.co.uk/sheds","…takes to put up a shed. Get tips for constructing a shed and key insights into garden shed assembly times, tools, and preparation tips for smooth installation.…","","","","Linked to different URL",""
"","6","garden shed","https://www.buyshedsdirect.co.uk/blog/post/make-huge-savings-on-wooden-sheds-this-bank-holiday-weekend-only","HUGE Savings on Sheds, This Bank Holiday Weekend! | BSD Blog","https://www.buyshedsdirect.co.uk/sheds","…50 designs and sizes. They are universally recognised as Britain’s best wooden garden sheds, bar none. Pressure treated and supplied with a market-leading 25-y…","","","","Opportunity found",""
"","6","garden shed","https://www.buyshedsdirect.co.uk/blog/post/read-our-exclusive-review-of-forests-brand-new-range-of-beckwood-sheds","Our Exclusive Review of Forest Beckwood Sheds | BSD Blog","https://www.buyshedsdirect.co.uk/sheds","…r: The Buy Sheds Direct Team Forest is Britain’s leading manufacturer of wooden garden sheds, and we are the Number 1 retailer of their products. Therefore, ear…","","","","Opportunity found",""
"","6","garden shed","https://www.buyshedsdirect.co.uk/blog/post/save-up-to-15-on-britains-number-1-line-of-wooden-sheds-now","Get Up To 15% Off Britain's Best Wooden Sheds Now | BSD Blog","https://www.buyshedsdirect.co.uk/sheds","…o allow doors and/ or windows to be installed in a variety of positions.Modular Garden ShedsGet over £300 off* the 10 x 8 Forest Timberdale Tongue & Groove Pres…","","","","Linked to different URL",""
"","6","garden shed","https://www.buyshedsdirect.co.uk/blog/post/shed-of-the-year-2015-an-update","Shed of the Year 2015: an update","https://www.buyshedsdirect.co.uk/sheds","…The competition is a fascinating chance to see how innovative and exceptional a garden shed can be and how it’s much more than a convenient outhouse for chuckin…","","","","Opportunity found",""
"","6","garden shed","https://www.buyshedsdirect.co.uk/blog/post/which-are-britains-10-strongest-most-secure-metal-garden-storage-units-and-sheds","The Strongest, Most Secure Metal Garden Storage | BSD Blog","https://www.buyshedsdirect.co.uk/sheds","…to assemble, it’s time to think again… 5 x 2'7 Absco Easy Store 1PE Green Metal Garden Shed (1.52m x 0.78m)The 5' x 2'7 Absco Easy Store 1PE Green Metal Garden…","","","","Linked to different URL",""
"","6","garden shed","https://www.buyshedsdirect.co.uk/blog/post/garden-shed-security-tips","Garden Shed Security Tips | Blogpost | Buy Sheds Direct UK","https://www.buyshedsdirect.co.uk/sheds","Garden shed security tips Posted: January 13, 2017 Categories: Author: The Buy S…","","","","Linked to different URL",""
"","6","garden shed","https://www.buyshedsdirect.co.uk/blog/post/working-form-home-using-your-shed-or-log-cabin-as-a-garden-office","Using your Shed or Log Cabin as a Garden Office | Buy Sheds Direct","https://www.buyshedsdirect.co.uk/sheds","…even started. This isn't always the most cost effective option. 3. Upgrade your garden shed If you already have a garden shed then the easiest option would be t…","","","","Opportunity found",""
"","6","garden shed","https://www.buyshedsdirect.co.uk/blog/post/which-is-the-best-garden-building-for-me","Which is the Best Garden Building or Garden Room for Me? | Complete Guide","https://www.buyshedsdirect.co.uk/sheds","…, heating and internet connectivity, and is designed for year-round use. 1) The Garden ShedIf you were to say the words ‘garden building’ to someone, chances ar…","","","","Weak anchor",""
"","6","garden shed","https://www.buyshedsdirect.co.uk/blog/post/shed-of-the-year-2016-episode-three","Shed of the Year 2016: Episode Three - Buy Sheds Direct","https://www.buyshedsdirect.co.uk/sheds","…me for creativity and invention where passion and ingenuity mix with the humble garden shed. The first shed we were introduced to is a showcase for builder/arti…","","","","Opportunity found",""
"","6","garden shed","https://www.buyshedsdirect.co.uk/blog/post/shed-of-the-year-2016-episode-two","Shed of the Year 2016: Episode Two - Buy Sheds Direct","https://www.buyshedsdirect.co.uk/sheds","…ouses for over 16 years and has created a hidden fantasy world in her 10 x 14ft garden shed. The 40 houses in Linda’s collection take you on a journey of miniat…","","","","Opportunity found",""
"","6","garden shed","https://www.buyshedsdirect.co.uk/blog/post/why-would-i-want-to-maintain-my-shed-surely-they-just-look-after-themselves","Why would I want to maintain my shed? Surely they just look after themselves?","https://www.buyshedsdirect.co.uk/sheds","…sted: January 13, 2017 Categories: Author: The Buy Sheds Direct Team The humble garden shed – highly functional, Tardis-like in its storage abilities, holder of…","","","","Opportunity found",""
"","6","garden shed","https://www.buyshedsdirect.co.uk/blog/post/shed-of-the-year-an-update","Shed of the Year: An Update | Blog | Buy Sheds Direct","https://www.buyshedsdirect.co.uk/sheds","…The competition is a fascinating chance to see how innovative and exceptional a garden shed can be and how it’s much more than a convenient outhouse for chuckin…","","","","Opportunity found",""
"","6","garden shed","https://www.buyshedsdirect.co.uk/blog/post/your-one-stop-guide-to-forests-fantastic-3-ranges-of-wooden-sheds","Your Guide to Forest's 3 Ranges of Wooden Sheds | BSD Blog","https://www.buyshedsdirect.co.uk/sheds","…n business, they’ve made more than 2 MILLION of them! Forest’s Family of Wooden Garden ShedsBeautifully designed and expertly built, the 10 x 6 Beckwood 25yr Gu…","","","","Weak anchor",""
"","6","garden shed","https://www.buyshedsdirect.co.uk/blog/post/hide-wheelie-bin-storage-ideas","Wheelie Bin Storage Ideas | Ideas to Disguise, Conceal or Hide Wheelie Bins","https://www.buyshedsdirect.co.uk/sheds","…bin visibility problem, provides privacy and is aesthetically pleasing.Inside a garden shedStoring your wheelie bins inside a garden shed is the best way to kee…","","","","Weak anchor",""
"","6","garden shed","https://www.buyshedsdirect.co.uk/blog/post/british-summer-time-brings-garden-thieves-out-of-hibernation","British Summer Time brings garden thieves out of hibernation - Buy Sheds Direct","https://www.buyshedsdirect.co.uk/sheds","…past 10-years show that after British Summer Time begins, thefts from gardens, garden sheds and garages increase rapidly by 25%. Apparently garden theft slowly…","","","","Opportunity found",""
"","6","garden shed","https://www.buyshedsdirect.co.uk/blog/post/garden-workshops-the-hardest-working-sheds","Garden Workshops: The Hardest Working Sheds | Buy Sheds Direct Blog","https://www.buyshedsdirect.co.uk/sheds","…, let alone Buy Sheds Direct, would ever dismiss the value of a traditional 6x4 garden shed. They will always bring people pleasure and, when it comes to garden…","","","","Opportunity found",""
"","6","garden shed","https://www.buyshedsdirect.co.uk/blog/post/make-garden-eco-friendly","How to make your garden eco-friendly - Buy Sheds Direct","https://www.buyshedsdirect.co.uk/sheds","…urchases It is also worth considering eco-friendly alternatives when choosing a garden shed. , available in a range of sizes and made from 100% recycled plastic…","","","","Opportunity found",""
"","6","garden shed","https://www.buyshedsdirect.co.uk/blog/category/sheds?page=11","Page 11 - Sheds | Garden Sheds | Blogs","https://www.buyshedsdirect.co.uk/sheds","…sted: January 13, 2017 Categories: Author: The Buy Sheds Direct Team The humble garden shed – highly functional, Tardis-like in its storage abilities, holder of…","","","","Linked to different URL",""
"","5","garden shed","https://www.buyshedsdirect.co.uk/blog","The Buy Sheds Direct Blog","https://www.buyshedsdirect.co.uk/sheds","…uary 20, 2026 Categories: , Author: The Buy Sheds Direct Team Looking for a new garden shed? There’s a lot to love about the Palram Canopia Skylight plastic she…","","","","Linked to different URL",""
