group,score,keyword,sourceUrl,sourceTitle,destinationUrl,snippet,gscImpressions,gscClicks,gscPosition,status,notes
"","5","garden shed","https://www.buyshedsdirect.co.uk/blog/post/4-reasons-to-love-palram-canopia-skylight-sheds","4 Reasons to Love Palram Canopia Skylight Sheds | Buy Sheds Direct","https://www.buyshedsdirect.co.uk/sheds","…any that knows a thing or two about designing and manufacturing premium plastic garden sheds. But don’t just take our word for it; in this blog, we’re going to…","","","","Opportunity found",""
"","5","garden shed","https://www.buyshedsdirect.co.uk/blog/category/garden-storage","Garden Storage | Outdoor Storage | Blogs","https://www.buyshedsdirect.co.uk/sheds","…irect Team Discover what made the list of your favourite products in 2025! From garden sheds to garden bars, these are the top-quality products that captured yo…","","","","Linked to different URL",""
"","5","garden shed","https://www.buyshedsdirect.co.uk/blog?page=2","Page 2 - The Buy Sheds Direct Blog","https://www.buyshedsdirect.co.uk/sheds","…irect Team Discover what made the list of your favourite products in 2025! From garden sheds to garden bars, these are the top-quality products that captured yo…","","","","Linked to different URL",""
"","5","garden shed","https://www.buyshedsdirect.co.uk/blog/post/shed-maintenance-tips-cleaning-care-advice","12 Shed Maintenance Tips | Expert Shed Cleaning, Care & Restoration Advice","https://www.buyshedsdirect.co.uk/sheds","garden shed","","","","Strong link",""
"","5","garden shed","https://www.buyshedsdirect.co.uk/blog/post/choosing-the-best-shed-for-your-garden-shed-design-ideas","Shed Design Ideas & Uses | Choosing the Best Shed for Your Garden","https://www.buyshedsdirect.co.uk/sheds","purchasing sheds online","","","","Strong link",""
"","5","garden shed","https://www.buyshedsdirect.co.uk/blog/post/10-of-our-favourite-black-november-deals","10 of Our Favourite Black November Deals | Buy Sheds Direct","https://www.buyshedsdirect.co.uk/sheds","…te Finish (3.03m x 3.76m)There are three main material choices when it comes to garden sheds: wood, plastic or metal. And when it comes to metal sheds, this fro…","","","","Opportunity found",""
"","5","garden shed","https://www.buyshedsdirect.co.uk/blog/post/spend-and-save-with-forest-garden","Spend and Save with Forest Garden | Buy Sheds Direct","https://www.buyshedsdirect.co.uk/sheds","…he key product categories where you could grab yourself a bargain…Forest Wooden Garden Sheds10' x 8' Forest Timberdale Tongue & Groove Pressure Treated Double D…","","","","Opportunity found",""
"","5","garden shed","https://www.buyshedsdirect.co.uk/blog/post/what-is-tongue-and-groove-cladding-for-sheds","What is Tongue and Groove Shed Cladding | Buy Sheds Direct","https://www.buyshedsdirect.co.uk/sheds","…option for any shed cladding project. Let us get started and find out why your garden shed deserves this cladding upgrade. Editor’s Note [14.11.25]: Our origin…","","","","Weak anchor",""
"","5","garden shed","https://www.buyshedsdirect.co.uk/blog/post/what-is-a-man-cave-shed-ideas-budget","Man Cave Ideas | 30 Best Man Caves & Man Cave Shed Ideas","https://www.buyshedsdirect.co.uk/sheds","…ong day. With countless man cave ideas to explore, now is the time to make that garden shed your own personal escape.Contact usDo you have questions about creat…","","","","Weak anchor",""
"","5","garden shed","https://www.buyshedsdirect.co.uk/blog/post/running-power-adding-electricity-to-a-shed","Wiring a Shed? Running Power & Electricity to a Shed Safely Installation Guide","https://www.buyshedsdirect.co.uk/sheds","…ur shed's electrical system If you follow these tips, you will ensure that your garden shed electricity system is safe and will last for many years to come: Fus…","","","","Weak anchor",""
"","5","garden shed","https://www.buyshedsdirect.co.uk/blog/post/clever-storage-ideas-for-small-sheds","25+ Clever Garden Shed Ideas | Small Shed Storage Ideas & Organisation Tips","https://www.buyshedsdirect.co.uk/sheds","Shop our range of garden sheds","","","","Strong link",""
"","5","garden shed","https://www.buyshedsdirect.co.uk/blog/post/how-to-hide-a-shed","How to Hide a Shed in a Small Garden | 6 Creative Ideas | Buy Sheds Direct","https://www.buyshedsdirect.co.uk/sheds","shed","","","","Strong link",""
"","5","garden shed","https://www.buyshedsdirect.co.uk/blog/post/garage-conversion-ideas-perfect-interior-makeover","Garage Conversion Ideas | Garage Interior Ideas & Makeover Tips","https://www.buyshedsdirect.co.uk/sheds","…are designed to prompt you to reconsider how you utilise your new space: Indoor garden shed - create a lush potting nook with hanging tools, mini greenhouse uni…","","","","Opportunity found",""
"","5","garden shed","https://www.buyshedsdirect.co.uk/blog/post/treating-fence-panels-guide","Treating Fence Panels | How to Preserve & Treat Wooden Fences","https://www.buyshedsdirect.co.uk/sheds","…them with even better protection. The same benefits apply to other garden wood, garden sheds, and log cabins, etc., the pressure treating process would benefit…","","","","Opportunity found",""
"","5","garden shed","https://www.buyshedsdirect.co.uk/blog/post/harnessing-solar-power-with-solar-panels-for-sheds","Solar Panels for Sheds | Harnessing Solar Power for Sheds (Kits & Stations)","https://www.buyshedsdirect.co.uk/sheds","…ed during sunny days for use when needed.What supplies do I need to assemble my garden shed? Preparation is vital if you are assembling your new garden shed or…","","","","Weak anchor",""
"","5","garden shed","https://www.buyshedsdirect.co.uk/blog/post/how-to-build-a-shed-base","How to Build a Shed Base | Guide to Building a Shed Foundation","https://www.buyshedsdirect.co.uk/sheds","shed","","","","Strong link",""
"","5","garden shed","https://www.buyshedsdirect.co.uk/blog/post/levelling-a-shed-base-sloped-or-uneven-ground","How to Level Ground for a Shed | Levelling a Shed Base on Uneven Ground","https://www.buyshedsdirect.co.uk/sheds","…int. If you have a retaining wall, this is extremely valuable when setting up a garden shed on seriously sloped land. It keeps the shed stable, stops erosion, a…","","","","Weak anchor",""
"","5","garden shed","https://www.buyshedsdirect.co.uk/blog/post/meet-our-suppliers-forest-garden","Meet Our Suppliers: Forest Garden | Buy Sheds Direct","https://www.buyshedsdirect.co.uk/sheds","…logo, marking them as sourced from well-managed and sustainable forests.Forest Garden ShedsForest produces three main shed ranges: , and . While there are diff…","","","","Opportunity found",""
"","5","garden shed","https://www.buyshedsdirect.co.uk/blog/post/garden-studio-design-tips-creative-home-space","10 Best Garden Room Ideas for a Creative Space at Home | Buy Sheds Direct","https://www.buyshedsdirect.co.uk/sheds","…are available in plastic, wood, and metal and can be considered an upgrade on a garden shed.Forest Mendip 5m x 4m Log Cabin Garden Office (45mm) - Click Image t…","","","","Opportunity found",""
"","5","garden shed","https://www.buyshedsdirect.co.uk/blog/category/garden-offices?page=3","Page 3 - Garden Offices | Garden Buildings | Blogs","https://www.buyshedsdirect.co.uk/sheds","…ing permission”? Usually, this is aimed at our log cabins, sometimes our larger garden sheds and, in one memorable conversation, at our compost bins… With the c…","","","","Opportunity found",""
"","5","garden shed","https://www.buyshedsdirect.co.uk/blog/post/7-magnificent-jubilee-offers-to-celebrate-70-years-of-the-queens-reign","Our Magnificent 7 Jubilee Offers | Buy Sheds Direct Blog","https://www.buyshedsdirect.co.uk/sheds","…d. To mark the Jubilee, we’re now offering you up to 20% off ALL of these regal garden sheds! That’s right, up to 20% off every single one of them. Not just the…","","","","Opportunity found",""
"","5","garden shed","https://www.buyshedsdirect.co.uk/blog/post/10-best-shed-accessories-upgrades","10 Best Shed Accessories for the Ultimate Shed Upgrade | Buy Sheds Direct","https://www.buyshedsdirect.co.uk/sheds","garden sheds","","","","Strong link",""
"","5","garden shed","https://www.buyshedsdirect.co.uk/blog/post/advantages-of-metal-sheds-vs-wooden-sheds","Metal Sheds vs Wooden Sheds: Which is Better? Advantages & Disadvantages","https://www.buyshedsdirect.co.uk/sheds","garden shed","","","","Strong link",""
"","5","garden shed","https://www.buyshedsdirect.co.uk/blog/post/plastic-sheds-vs-wooden-sheds","Plastic vs Wood Shed | Which is the Right One for You? | Buy Sheds Direct","https://www.buyshedsdirect.co.uk/sheds","garden shed","","","","Strong link",""
"","5","garden shed","https://www.buyshedsdirect.co.uk/blog/post/how-long-do-wooden-sheds-last-maintenance-and-repairs","How Long Do Wooden Sheds Last? Tips for Maintenance & Repairs","https://www.buyshedsdirect.co.uk/sheds","…nd wood treatments where applicable is essential to maintain the health of your garden shed. UV protection is also recommended to stop the yellowing and degrada…","","","","Weak anchor",""
"","5","garden shed","https://www.buyshedsdirect.co.uk/blog/post/how-to-weatherproof-and-waterproof-a-shed","How to Waterproof a Shed & Weatherproof a Shed | Stop Rot, Damp & Damage","https://www.buyshedsdirect.co.uk/sheds","shed","","","","Strong link",""
"","5","garden shed","https://www.buyshedsdirect.co.uk/blog/post/how-to-insulate-a-garden-shed","Insulating a Shed | How to Insulate a Garden Shed Guide & Tips","https://www.buyshedsdirect.co.uk/sheds","sheds","","","","Strong link",""
"","5","garden shed","https://www.buyshedsdirect.co.uk/blog/post/overlap-or-tongue-and-groove-shed","Overlap or Tongue and Groove Shed? Features & Differences | Buy Sheds Direct","https://www.buyshedsdirect.co.uk/sheds","garden shed","","","","Strong link",""
"","5","garden shed","https://www.buyshedsdirect.co.uk/blog/post/what-is-tongue-and-groove-cladding-for-sheds","What is Tongue and Groove Shed Cladding | Buy Sheds Direct","https://www.buyshedsdirect.co.uk/sheds","…option for any shed cladding project. Let us get started and find out why your garden shed deserves this cladding upgrade. Editor’s Note [14.11.25]: Our origin…","","","","Weak anchor",""
"","5","garden shed","https://www.buyshedsdirect.co.uk/blog/post/how-to-dismantle-a-shed","How to Dismantle a Shed | Learn How to Take Down a Shed Properly","https://www.buyshedsdirect.co.uk/sheds","garden sheds","","","","Strong link",""
"","5","garden shed","https://www.buyshedsdirect.co.uk/blog/post/do-plastic-sheds-need-a-base","Do Plastic Sheds Need a Base? Base Ideas for Shed Stability | Buy Sheds Direct","https://www.buyshedsdirect.co.uk/sheds","…g a base which becomes a problem slowly over time.7' x 7' Keter Premier Plastic Garden Shed (2.29m x 2.23m) - Click Image to ViewMoisture preventionHaving a bas…","","","","Weak anchor",""
"","5","garden shed","https://www.buyshedsdirect.co.uk/blog/post/apex-or-pent-shed-roof","Apex or Pent Shed Roof | How to Choose the Right Style | Buy Sheds Direct","https://www.buyshedsdirect.co.uk/sheds","…t, that you will have seen far and wide. Whether it is country-style or classic garden sheds, the apex vs pent argument will often fall on this side.What is a p…","","","","Weak anchor",""
"","5","garden shed","https://www.buyshedsdirect.co.uk/blog/post/top-garden-tool-storage-ideas-solutions","Top Garden Tool Storage Ideas | Tool Organiser for Shed & Storage Solutions","https://www.buyshedsdirect.co.uk/sheds","…dgeable team is here to help you with the best tips for utilising space in your garden shed: Calls - for inquiries, call us at 0333 003 0514 to discuss your gar…","","","","Weak anchor",""
"","5","garden shed","https://www.buyshedsdirect.co.uk/blog/post/what-is-a-potting-shed-ideas-for-gardeners","What is a Potting Shed? Practical & Stylish Potting Shed Ideas","https://www.buyshedsdirect.co.uk/sheds","garden sheds","","","","Strong link",""
"","5","garden shed","https://www.buyshedsdirect.co.uk/blog/post/garden-room-design-ideas-guide","Garden Room Design Ideas | How to Design a Luxury Garden Room Guide","https://www.buyshedsdirect.co.uk/sheds","…think about security and privacy. Whether you are designing a garden room or a garden shed, factor these two essential features into your design from day one a…","","","","Opportunity found",""
"","5","garden shed","https://www.buyshedsdirect.co.uk/blog/post/how-to-lay-slab-base-for-sheds","How to Lay a Paving Slab Shed Base Correctly | Buy Sheds Direct","https://www.buyshedsdirect.co.uk/sheds","…for years to come, read on to discover the secrets of choosing a slab base for garden sheds! Editor’s Note [02.11.23]: Our guide to slab base for sheds and how…","","","","Weak anchor",""
"","5","garden shed","https://www.buyshedsdirect.co.uk/blog/post/shed-of-the-year-2022-our-shed-experts-reveal-britains-best-garden-shed","Shed Of the Year 2022 | Garden Sheds | Buy Sheds Direct Blog","https://www.buyshedsdirect.co.uk/sheds","the nation’s favourite sheds","","","","Strong link",""
"","5","garden shed","https://www.buyshedsdirect.co.uk/blog/post/how-to-insulate-a-garden-shed","Insulating a Shed | How to Insulate a Garden Shed Guide & Tips","https://www.buyshedsdirect.co.uk/sheds","sheds","","","","Strong link",""
"","5","garden shed","https://www.buyshedsdirect.co.uk/blog/post/how-to-paint-a-shed","How to Paint a Shed Step-by-Step Guide | Tips & Ideas for Painting a Shed","https://www.buyshedsdirect.co.uk/sheds","garden shed","","","","Strong link",""
"","5","garden shed","https://www.buyshedsdirect.co.uk/blog/category/sheds?page=7","Page 7 - Sheds | Garden Sheds | Blogs","https://www.buyshedsdirect.co.uk/sheds","…Sheds Direct Team Learn about the top five essential tools you need to build a garden shed. From saws to levels, this guide will cover everything you need to e…","","","","Opportunity found",""
"","5","garden shed","https://www.buyshedsdirect.co.uk/blog/post/how-britains-best-range-of-wooden-sheds-has-just-got-bigger-and-better","Britain’s Best Wooden Sheds Range Just Got Bigger | BSD Blog","https://www.buyshedsdirect.co.uk/sheds","…ittle upgrade that’s been implemented across the entire range of these superior garden sheds.The New Extended Range of Forest Timberdale Wooden ShedsYou can sav…","","","","Linked to different URL",""
"","5","garden shed","https://www.buyshedsdirect.co.uk/blog/post/theres-still-time-to-shop-our-biggest-and-best-black-november-ever","Black November Deals Roundup | Buy Sheds Direct","https://www.buyshedsdirect.co.uk/sheds","…den Shed (1.89m x 1.34m) now!Forest is Britain’s leading manufacturer of wooden garden sheds, so when you buy a Forest Shed, you know you’re getting a top-quali…","","","","Opportunity found",""
"","5","garden shed","https://www.buyshedsdirect.co.uk/blog/post/5-fabulous-wooden-garden-storage-deals-for-a-tidy-patio-this-autumn","5 Fabulous Wooden Garden Storage Deals | Buy Sheds Direct","https://www.buyshedsdirect.co.uk/sheds","…ased in the Heart of England, Forest is the UK’s leading manufacturer of wooden garden sheds and storage. Respected throughout the industry and a Carbon Neutral…","","","","Opportunity found",""
"","5","garden shed","https://www.buyshedsdirect.co.uk/blog/post/for-the-best-wooden-shed-you-simply-have-to-shop-forest-premium","Forest Premium Sheds | Best Wooden Sheds | Buy Sheds Direct","https://www.buyshedsdirect.co.uk/sheds","…June 01, 2022 Categories: , Author: The Buy Sheds Direct Team If only the best garden shed will do, you need to read on because we’ve got a brand-new range of…","","","","Opportunity found",""
"","5","garden shed","https://www.buyshedsdirect.co.uk/blog/post/Forest-midi-garden-shed-giveaway","Forest Midi Garden Shed Giveaway","https://www.buyshedsdirect.co.uk/sheds","Forest Midi Garden Shed Giveaway Posted: February 03, 2020 Categories: Author: The Buy Sheds…","","","","Opportunity found",""
"","5","garden shed","https://www.buyshedsdirect.co.uk/blog/post/our-favourite-shed-of-the-year-2016-entries","Our favourite Shed of the Year 2016 entries - Buy Sheds Direct","https://www.buyshedsdirect.co.uk/sheds","…et' end of the scale, this cute and functional shed is right up our street. Old Garden Shed, Reader Sheds http://www.readersheds.co.uk/share.cfm?SHARESHED=5861…","","","","Opportunity found",""
"","5","garden shed","https://www.buyshedsdirect.co.uk/blog/post/shed-of-the-year-2015-the-second-episode","Shed of the Year 2015: The Second Episode | Blog | Buy Sheds Direct","https://www.buyshedsdirect.co.uk/sheds","…£9000 pounds, four oak posts support the treetop platform of which the standard garden shed was built. Inside there is space for ten to enjoy and inside it even…","","","","Opportunity found",""
"","5","garden shed","https://www.buyshedsdirect.co.uk/blog/post/shed-of-the-year-2013","Blogpost: Shed of the Year 2013 | Buy Sheds Direct","https://www.buyshedsdirect.co.uk/sheds","…Author: The Buy Sheds Direct Team With two thirds of adults in the UK owning a garden shed, it was only a matter of time before there was a prize for the best!…","","","","Opportunity found",""
"","5","garden shed","https://www.buyshedsdirect.co.uk/blog/post/shed-of-the-year-2015-the-finalists","Shed of the Year 2015: The Finalists | Blog | Buy Sheds Direct","https://www.buyshedsdirect.co.uk/sheds","…wonderful creations that demonstrate that the UK’s relationship with the humble garden shed is nothing if not unique. More than 2,500 hopefuls entered this year…","","","","Opportunity found",""
"","5","garden shed","https://www.buyshedsdirect.co.uk/blog/post/shed-of-the-year-2012","Garden Shed of the Year 2012| Buy Sheds Direct","https://www.buyshedsdirect.co.uk/sheds","Shop our range of garden sheds","","","","Strong link",""
"","5","garden shed","https://www.buyshedsdirect.co.uk/blog/category/news-interviews-and-competitions?page=7","Page 7 - News, Interviews and Competitions | Blog","https://www.buyshedsdirect.co.uk/sheds","…The competition is a fascinating chance to see how innovative and exceptional a garden shed can be and how it’s much more than Posted: April 07, 2015 Categories…","","","","Opportunity found",""
"","5","garden shed","https://www.buyshedsdirect.co.uk/blog/post/how-to-insulate-a-garden-shed","Insulating a Shed | How to Insulate a Garden Shed Guide & Tips","https://www.buyshedsdirect.co.uk/sheds","sheds","","","","Strong link",""
"","5","garden shed","https://www.buyshedsdirect.co.uk/blog/post/everything-you-need-to-know-about-modular-garden-products","Everything You Need to Know About Modular Designs | BSD Blog","https://www.buyshedsdirect.co.uk/sheds","…elf version .Our Superb Range of Modular Garden ProductsBritain's best range of garden sheds, Forest Timberdale, are modular sheds too.Because of their many ben…","","","","Opportunity found",""
"","5","garden shed","https://www.buyshedsdirect.co.uk/blog/post/why-you-should-consider-buying-a-summer-house-in-2023","Why Consider a Summer House for Your Garden | Inspiring Summerhouse Ideas & Uses","https://www.buyshedsdirect.co.uk/sheds","…s can be used not only in the summer but also during the winter. In contrast to garden sheds, which are mostly used for storage, they are primarily about relaxa…","","","","Opportunity found",""
"","5","garden shed","https://www.buyshedsdirect.co.uk/blog/post/should-i-buy-a-summer-house-or-a-log-cabin","Should I Buy A Summer House or Log Cabin? | Buy Sheds Direct","https://www.buyshedsdirect.co.uk/sheds","…es typically have a wall thickness of 7 – 12mm, which is akin to a high-quality garden shed. Log cabins have much heavier cladding, ranging up to 70mm, which is…","","","","Opportunity found",""
"","5","garden shed","https://www.buyshedsdirect.co.uk/blog/post/top-5-garden-buildings","Top 5 garden buildings - Buy Sheds Direct","https://www.buyshedsdirect.co.uk/sheds","…ry about rummaging through things in the dark! This is everything you need in a garden shed. Made from heavy-duty materials, it features a solid, interlocking t…","","","","Opportunity found",""
"","5","garden shed","https://www.buyshedsdirect.co.uk/blog/post/top-tips-for-setting-up-a-garden-workshop","Top tips for setting up a garden workshop - Buy Sheds Direct","https://www.buyshedsdirect.co.uk/sheds","…ply for lighting and your electric drill. Consider how you’ll get power to your garden shed – you could lay a cable under the lawn. Get a qualified electrician…","","","","Opportunity found",""
"","5","garden shed","https://www.buyshedsdirect.co.uk/blog/post/diy-garage-storage-design-shelving-workbench-ideas","DIY Garage Storage Design Ideas | Garage Shelving & Workbench Ideas","https://www.buyshedsdirect.co.uk/sheds","…ccessible when needed.12' x 8' Traditional Shiplap Dutch Barn Heavy Duty Wooden Garden Shed (3.66m x 2.44m) - Click Image to ViewAdd ceiling hooksFit ceiling ho…","","","","Opportunity found",""
"","5","garden shed","https://www.buyshedsdirect.co.uk/blog/post/innovative-garden-storage-ideas-solutions","Innovative Garden Storage Ideas & Solutions | Buy Sheds Direct","https://www.buyshedsdirect.co.uk/sheds","…se. You can buy storage sheds, tool sheds, and a range of other general-purpose garden sheds to fit your available footprint.2) Storage boxes and chests4'3 x 2'…","","","","Opportunity found",""
"","5","garden shed","https://www.buyshedsdirect.co.uk/blog/post/top-5-garden-storage-solutions","Top 5 Garden Storage Solutions | Buy Sheds Direct UK","https://www.buyshedsdirect.co.uk/sheds","…arden storage solution can be a task in itself. If you've out grown your humble garden shed, you might want to consider a smaller or ? These are easily secured…","","","","Opportunity found",""
"","5","garden shed","https://www.buyshedsdirect.co.uk/blog/post/top-5-metal-sheds-and-stores","Top 5 Metal Sheds and Stores | Buy Sheds Direct UK","https://www.buyshedsdirect.co.uk/sheds","…tegories: , Author: The Buy Sheds Direct Team We take a look at our top 5 metal garden sheds and stores for your garden this year. Check out our top picks below…","","","","Linked to different URL",""
"","5","garden shed","https://www.buyshedsdirect.co.uk/blog/post/how-to-stack-and-store-logs-for-the-winter","How to stack and store logs for the winter | Blog | Buy Sheds Direct","https://www.buyshedsdirect.co.uk/sheds","…hout compromising air circulation. The classic log store design is similar to a garden shed – a wooden or metal structure with a sloping roof that allows rainwa…","","","","Opportunity found",""
"","5","garden shed","https://www.buyshedsdirect.co.uk/blog/post/11-ways-to-completely-revamp-your-log-storage-shed","11 Ways to Revamp Your Log Storage Shed | Buy Sheds Direct","https://www.buyshedsdirect.co.uk/sheds","…d herbs. Build a Shed Extension Most gardens will eventually require a standard garden shed to store all tools and equipment, so why not combine the two by buil…","","","","Opportunity found",""
"","5","garden shed","https://www.buyshedsdirect.co.uk/blog/post/how-to-hide-a-shed","How to Hide a Shed in a Small Garden | 6 Creative Ideas | Buy Sheds Direct","https://www.buyshedsdirect.co.uk/sheds","shed","","","","Strong link",""
"","5","garden shed","https://www.buyshedsdirect.co.uk/blog/post/treating-fence-panels-guide","Treating Fence Panels | How to Preserve & Treat Wooden Fences","https://www.buyshedsdirect.co.uk/sheds","…them with even better protection. The same benefits apply to other garden wood, garden sheds, and log cabins, etc., the pressure treating process would benefit…","","","","Opportunity found",""
"","5","garden shed","https://www.buyshedsdirect.co.uk/blog/post/treating-fence-panels-guide","Treating Fence Panels | How to Preserve & Treat Wooden Fences","https://www.buyshedsdirect.co.uk/sheds","…them with even better protection. The same benefits apply to other garden wood, garden sheds, and log cabins, etc., the pressure treating process would benefit…","","","","Opportunity found",""
"","5","garden shed","https://www.buyshedsdirect.co.uk/blog/post/5-brand-new-forest-products-to-transform-your-garden-this-spring","Brand-New Forest Products to Transform Any Garden | BSD Blog","https://www.buyshedsdirect.co.uk/sheds","…d backed by an incredible 25-year guarantee. A smart modular design means these garden sheds are delivered in smaller sections of interchangeable panels, making…","","","","Opportunity found",""
"","5","garden shed","https://www.buyshedsdirect.co.uk/blog/post/levelling-a-shed-base-sloped-or-uneven-ground","How to Level Ground for a Shed | Levelling a Shed Base on Uneven Ground","https://www.buyshedsdirect.co.uk/sheds","…int. If you have a retaining wall, this is extremely valuable when setting up a garden shed on seriously sloped land. It keeps the shed stable, stops erosion, a…","","","","Weak anchor",""
"","5","garden shed","https://www.buyshedsdirect.co.uk/blog/post/functional-garden-building","Adding functional space to your garden | Buy Sheds Direct UK","https://www.buyshedsdirect.co.uk/sheds","…your garden Posted: July 25, 2012 Categories: Author: The Buy Sheds Direct Team Garden sheds are a mainstay of most gardens – But you may never have considered…","","","","Opportunity found",""
"","5","garden shed","https://www.buyshedsdirect.co.uk/blog/post/are-plastic-sheds-any-good","Are Plastic Sheds Any Good? Discover The Best Plastic Sheds You Can Buy","https://www.buyshedsdirect.co.uk/sheds","garden storage shed","","","","Strong link",""
"","5","garden shed","https://www.buyshedsdirect.co.uk/blog/post/five-tools-you-need-to-build-a-shed","Essential DIY Tools You Need to Build a Shed | Buy Sheds Direct","https://www.buyshedsdirect.co.uk/sheds","garden shed","","","","Strong link",""
