group,score,keyword,sourceUrl,sourceTitle,destinationUrl,snippet,gscImpressions,gscClicks,gscPosition,status,notes
"","5","garden shed","https://www.buyshedsdirect.co.uk/blog/post/how-to-insulate-a-garden-shed","Insulating a Shed | How to Insulate a Garden Shed Guide & Tips","https://www.buyshedsdirect.co.uk/sheds","sheds","","","","Strong link",""
"","5","garden shed","https://www.buyshedsdirect.co.uk/blog/post/should-i-buy-a-metal-plastic-or-wooden-shed-which-is-the-best-material","Should I Buy a Metal, Plastic or Wooden Shed? | BSD Blog","https://www.buyshedsdirect.co.uk/sheds","our shed homepage","","","","Strong link",""
"","5","garden shed","https://www.buyshedsdirect.co.uk/blog/post/enjoy-superb-savings-on-the-uks-best-wooden-sheds-now","Enjoy Superb Savings on the Best Wooden Sheds Now | BSD Blog","https://www.buyshedsdirect.co.uk/sheds","…he most secure wooden sheds on the market. Unbeatably Luxurious Sheds With some garden sheds, you can upgrade certain features by paying more for optional extra…","","","","Opportunity found",""
"","5","garden shed","https://www.buyshedsdirect.co.uk/blog/post/shed-of-the-year-2016-episode-one","Shed of the Year 2016: Episode One - Buy Sheds Direct","https://www.buyshedsdirect.co.uk/sheds","…ritish competition celebrates the splendour of all things shed! The once humble garden shed has become a home for hidden passions, hobbies, cutting edge design…","","","","Opportunity found",""
"","5","garden shed","https://www.buyshedsdirect.co.uk/blog/post/what-the-shed-of-the-year-winners-have-taught-us-over-the-years","What the Shed of the Year Winners Have Taught us Over the Years | Blog | Buy Sheds Direct","https://www.buyshedsdirect.co.uk/sheds","…ar example of a creative mind. This shed had very humble beginnings as a simple garden shed. This shed went from providing sanctuary from the stresses of family…","","","","Opportunity found",""
"","5","garden shed","https://www.buyshedsdirect.co.uk/blog/post/what-do-you-get-up-to-in-your-shed","What do you get up to in your Shed | Blog | Buy Sheds Direct","https://www.buyshedsdirect.co.uk/sheds","…“persons”) shed is now his castle ! So what are the top ten things we do in our Garden Sheds? 1. Tinker with tools (41%)2. Gather junk (37%)3. Pot up plants for…","","","","Opportunity found",""
"","5","garden shed","https://www.buyshedsdirect.co.uk/blog/post/the-best-apps-to-get-you-gardening","7 Great mobile apps to help you in the garden - Buy Sheds Direct","https://www.buyshedsdirect.co.uk/sheds","…garden Posted: July 23, 2015 Categories: Author: The Buy Sheds Direct Team Your garden shed no doubt contains the essentials; gloves, lopper, hand trowel, soil…","","","","Opportunity found",""
"","5","garden shed","https://www.buyshedsdirect.co.uk/blog/post/british-shun-holidays-for-garden-projects-this-summer","British Shun Holidays for Garden Projects | Blog | Buy Sheds Direct","https://www.buyshedsdirect.co.uk/sheds","…es does it take to lift a hot tub? Undoubtedly, securing some of these items in garden sheds or garden storage with good locks would’ve reduced the risk of thef…","","","","Opportunity found",""
"","5","garden shed","https://www.buyshedsdirect.co.uk/blog/post/solar-shed-lights-that-dont-cost-the-earth","Solar Shed Lights that don't cost the earth | Blog | Buy Sheds Direct","https://www.buyshedsdirect.co.uk/sheds","…w solar lights can be discretely fitted to any outdoor building, whether it’s a garden sheds, summerhouses or workshops. With ranges of shed solar lights for ga…","","","","Opportunity found",""
"","5","garden shed","https://www.buyshedsdirect.co.uk/blog/post/top-5-tips-for-buying-a-new-shed","Top 5 Tips for Buying a New Shed | Garden Sheds","https://www.buyshedsdirect.co.uk/sheds","Shop our range of garden sheds","","","","Strong link",""
"","5","garden shed","https://www.buyshedsdirect.co.uk/blog/category/sheds?page=10","Page 10 - Sheds | Garden Sheds | Blogs","https://www.buyshedsdirect.co.uk/sheds","…Author: The Buy Sheds Direct Team With two thirds of adults in the UK owning a garden shed, it was only a matter of time before there was a prize for the best!…","","","","Opportunity found",""
"","5","garden shed","https://www.buyshedsdirect.co.uk/blog/category/outdoor-living?page=11","Page 11 - Outdoor Living | Garden Lifestyle | Blogs","https://www.buyshedsdirect.co.uk/sheds","…k next Posted: July 23, 2015 Categories: Author: The Buy Sheds Direct Team Your garden shed no doubt contains the essentials; gloves, lopper, hand trowel, soil…","","","","Opportunity found",""
"","5","garden shed","https://www.buyshedsdirect.co.uk/blog","The Buy Sheds Direct Blog","https://www.buyshedsdirect.co.uk/sheds","…uary 20, 2026 Categories: , Author: The Buy Sheds Direct Team Looking for a new garden shed? There’s a lot to love about the Palram Canopia Skylight plastic she…","","","","Linked to different URL",""
"","5","garden shed","https://www.buyshedsdirect.co.uk/blog/post/make-the-most-of-your-garden-in-summer","Make the most of your garden in summer - Buy Sheds Direct","https://www.buyshedsdirect.co.uk/sheds","…of the best ways to mark the increase in sunlight is to install solar lights on garden sheds, which will help harvest all of the extra light to use as passive e…","","","","Opportunity found",""
"","5","garden shed","https://www.buyshedsdirect.co.uk/blog/post/securing-your-shed-this-summer","Securing Your Shed This Summer | Blog | Buy Sheds Direct","https://www.buyshedsdirect.co.uk/sheds","…the deterrents do not work. If you are looking for some extra security for your garden shed take a look at the accessories we have to offer:","","","","Opportunity found",""
"","5","garden shed","https://www.buyshedsdirect.co.uk/blog/post/guide-growing-9-popular-spring-vegetables","Growing 9 popular spring vegetables | Buy Sheds Direct","https://www.buyshedsdirect.co.uk/sheds","…ebris left from the winter and to cut away diseased or broken branches. Get the garden shed organised and ready whilst also checking the condition of sprinklers…","","","","Opportunity found",""
"","4","garden shed","https://www.buyshedsdirect.co.uk/blog?page=5","Page 5 - The Buy Sheds Direct Blog","https://www.buyshedsdirect.co.uk/sheds","…r 28, 2025 Categories: Author: The Buy Sheds Direct Team Looking to buy a metal garden shed? Find out more about Yardmaster, an expert in the field and a compan…","","","","Linked to different URL",""
"","4","garden shed","https://www.buyshedsdirect.co.uk/blog/category/sheds?page=2","Page 2 - Sheds | Garden Sheds | Blogs","https://www.buyshedsdirect.co.uk/sheds","…r 28, 2025 Categories: Author: The Buy Sheds Direct Team Looking to buy a metal garden shed? Find out more about Yardmaster, an expert in the field and a compan…","","","","Linked to different URL",""
"","4","garden shed","https://www.buyshedsdirect.co.uk/blog/post/garden-tools-list-equipment-accessories-essentials","Garden Tools List | Essential Gardening Tools & Equipment | Buy Sheds Direct","https://www.buyshedsdirect.co.uk/sheds","…or secateurs, you will need them to tackle larger garden projects.9) SpadeEvery garden shed needs a hook for a spade. Read more in our called “”10) Watering can…","","","","Weak anchor",""
"","4","garden shed","https://www.buyshedsdirect.co.uk/blog/post/garden-office-interior-design-ideas-layouts-tips","Garden Office Interior Design Ideas | Garden Office Design Layouts & Tips","https://www.buyshedsdirect.co.uk/sheds","…den office ideasFor advice on creating your dream garden room or transforming a garden shed into a stylish outdoor workspace, contact today. Whether you are des…","","","","Weak anchor",""
"","4","garden shed","https://www.buyshedsdirect.co.uk/blog/post/do-i-need-planning-permission-for-sheds-or-log-cabins","Planning Permission For Sheds Or Log Cabins | Buy Sheds Direct","https://www.buyshedsdirect.co.uk/sheds","Shop our range of garden sheds","","","","Strong link",""
"","4","garden shed","https://www.buyshedsdirect.co.uk/blog/post/how-to-soundproof-a-drumming-shed","Drumming Shed | Complete Guide to Soundproofing a Shed for Drums","https://www.buyshedsdirect.co.uk/sheds","garden shed","","","","Strong link",""
"","4","garden shed","https://www.buyshedsdirect.co.uk/blog/post/our-latest-shed-deal-roundup-is-here","Shed Deal Roundup | Garden Sheds | Buy Sheds Direct Blog","https://www.buyshedsdirect.co.uk/sheds","Shop our superb range of sheds now!","","","","Strong link",""
"","4","garden shed","https://www.buyshedsdirect.co.uk/blog/post/your-guide-to-creating-a-log-cabin-garden-office","Your Guide to Creating a Log Cabin Home Office | Buy Sheds Direct","https://www.buyshedsdirect.co.uk/sheds","…a specialist business insurer too. Planning Permission When you buy a standard garden shed or summer house for recreational use, you do not need to apply for p…","","","","Weak anchor",""
"","4","garden shed","https://www.buyshedsdirect.co.uk/blog/post/shed-buying-guide","Shed buying guide","https://www.buyshedsdirect.co.uk/sheds","…watch our video to make sure you understand all of the terminology involved in garden sheds to make sure you know what is best for you.","","","","Linked to different URL",""
"","4","garden shed","https://www.buyshedsdirect.co.uk/blog/category/sheds?page=8","Page 8 - Sheds | Garden Sheds | Blogs","https://www.buyshedsdirect.co.uk/sheds","…r: The Buy Sheds Direct Team Forest is Britain’s leading manufacturer of wooden garden sheds. Discover the differences between their fantastic 3 ranges of woode…","","","","Linked to different URL",""
"","4","garden shed","https://www.buyshedsdirect.co.uk/blog/category/sheds?page=9","Page 9 - Sheds | Garden Sheds | Blogs","https://www.buyshedsdirect.co.uk/sheds","…James Laidler While we love wildlife, we don't necessrarily want it inside our garden shed. Here are some top tips to help you bug-proof your shed.","","","","Linked to different URL",""
"","4","garden shed","https://www.buyshedsdirect.co.uk/blog/post/how-forest-4life-sheds-are-rewriting-the-rule-book-for-wooden-sheds-longevity","You’ll Only Ever Need One Shed with A 4Life™ Shed | BSD Blog","https://www.buyshedsdirect.co.uk/sheds","…to represent the sheds’ most desirable qualities. As it’s our business to sell garden sheds, we view these brand names with considerable interest, and one in p…","","","","Linked to different URL",""
"","4","garden shed","https://www.buyshedsdirect.co.uk/blog/post/preparing-for-your-new-shed","Shed Base Guide | Blog | Buy Sheds Direct","https://www.buyshedsdirect.co.uk/sheds","Shop our range of garden sheds","","","","Strong link",""
"","4","garden shed","https://www.buyshedsdirect.co.uk/blog/post/buyers-guide-garden-sheds","Buyers Guide to Garden Sheds | Blog | Buy Sheds Direct","https://www.buyshedsdirect.co.uk/sheds","The Buyers Guide to Garden Sheds Posted: February 08, 2011 Categories: Author: The Buy Sheds Direct…","","","","Linked to different URL",""
"","4","garden shed","https://www.buyshedsdirect.co.uk/blog/post/how-to-turn-your-shed-into-the-perfect-den-for-big-kids","How to turn a shed into a den | Blog | Buy Sheds Direct","https://www.buyshedsdirect.co.uk/sheds","…know in the comments section below if you have any other ideas as to creating a garden shed den; we'd love to hear your suggestions! Please don't forget to shar…","","","","Weak anchor",""
"","4","garden shed","https://www.buyshedsdirect.co.uk/blog/post/why-a-garden-shed-is-perfect-for-the-upcoming-heatwave","Why a garden shed is perfect for the upcoming heatwave | Blog | Buy Sheds Direct","https://www.buyshedsdirect.co.uk/sheds","Buying a new shed","","","","Strong link",""
"","3","garden shed","https://www.buyshedsdirect.co.uk/blog/post/20-raised-garden-bed-ideas-and-designs","20+ Raised Garden Bed Ideas & Stylish DIY Raised Bed Designs","https://www.buyshedsdirect.co.uk/sheds","shed","","","","Weak anchor",""
"","3","garden shed","https://www.buyshedsdirect.co.uk/blog/post/how-to-build-a-summer-house-is-planning-permission-required","DIY Guide to Building a Summerhouse | Summer House Planning Permission","https://www.buyshedsdirect.co.uk/sheds","sheds","","","","Weak anchor",""
"","3","garden shed","https://www.buyshedsdirect.co.uk/blog/post/inexpensive-privacy-fence-ideas","Cheap & Inexpensive Privacy Fence Ideas for a Stylish & Secure Garden","https://www.buyshedsdirect.co.uk/sheds","sheds","","","","Weak anchor",""
"","3","garden shed","https://www.buyshedsdirect.co.uk/blog/post/how-to-turn-your-garden-shed-into-santas-grotto","How To Turn Your Shed Into Santa's Grotto | Buy Sheds Direct","https://www.buyshedsdirect.co.uk/sheds","garden shed","","","","Strong link",""
"","3","garden shed","https://www.buyshedsdirect.co.uk/blog/post/shed-roof-felt-replacement-guide","Shed Roof Felt Replacement Guide | Best Shed Roofing Material EPDM vs Felt","https://www.buyshedsdirect.co.uk/sheds","shed","","","","Weak anchor",""
"","3","garden shed","https://www.buyshedsdirect.co.uk/blog/post/grow-your-own-fruit-and-veg-this-year-with-our-latest-gardening-deals","Grow Your Own Fruit and Veg This Year With Our Latest Gardening Deals","https://www.buyshedsdirect.co.uk/sheds","sheds","","","","Weak anchor",""
"","3","garden shed","https://www.buyshedsdirect.co.uk/blog/post/gardening-for-health-why-it-is-good-for-you","Gardening for Health | Why Gardening is Good for You | Buy Sheds Direct","https://www.buyshedsdirect.co.uk/sheds","shed","","","","Weak anchor",""
"","3","garden shed","https://www.buyshedsdirect.co.uk/blog/post/diy-pergola-plans-designs-ideas","DIY Pergolas | Ideas for Garden Pergolas | Homemade Pergola Design Plans","https://www.buyshedsdirect.co.uk/sheds","Sheds","","","","Weak anchor",""
"","3","garden shed","https://www.buyshedsdirect.co.uk/blog/post/garage-design-ideas","Garage Ideas for a Stylish Makeover | Garage Design, Décor & Paint Ideas","https://www.buyshedsdirect.co.uk/sheds","shed","","","","Weak anchor",""
"","3","garden shed","https://www.buyshedsdirect.co.uk/blog/post/garden-office-ideas-designs-planning","Garden Office Ideas & Designs 2026 | Garden Office Planning Made Easy","https://www.buyshedsdirect.co.uk/sheds","shed","","","","Weak anchor",""
"","3","garden shed","https://www.buyshedsdirect.co.uk/blog/post/buy-sheds-direct-christmas-2025-opening-hours","Christmas 2025 Opening Hours | Buy Sheds Direct","https://www.buyshedsdirect.co.uk/sheds","sheds","","","","Weak anchor",""
"","3","garden shed","https://www.buyshedsdirect.co.uk/blog/post/creative-garden-seating-areas-ideas","12 Creative Garden Seating Areas, Ideas & Unique Outdoor Seating Tips","https://www.buyshedsdirect.co.uk/sheds","sheds","","","","Weak anchor",""
"","3","garden shed","https://www.buyshedsdirect.co.uk/blog/post/how-to-apply-for-shed-planning-permission","Garden Building & Shed Planning Permission | Complete Guide & Tips","https://www.buyshedsdirect.co.uk/sheds","Garden sheds","","","","Strong link",""
"","3","garden shed","https://www.buyshedsdirect.co.uk/blog/post/garden-room-insulation-guide","Garden Room Insulation Guide | How to Insulate a Garden Room","https://www.buyshedsdirect.co.uk/sheds","sheds","","","","Weak anchor",""
"","3","garden shed","https://www.buyshedsdirect.co.uk/blog/post/greenhouse-staging-shelving-storage-ideas","Greenhouse Staging & Shelving Ideas | Storage Tips for Every Setup","https://www.buyshedsdirect.co.uk/sheds","sheds","","","","Weak anchor",""
"","3","garden shed","https://www.buyshedsdirect.co.uk/blog/post/playhouse-planning-permission","Do You Need Planning Permission for a Garden Playhouse?","https://www.buyshedsdirect.co.uk/sheds","sheds","","","","Weak anchor",""
"","3","garden shed","https://www.buyshedsdirect.co.uk/blog/post/garden-room-uses-how-to-create-your-own-garden-music-studio","Garden Room Uses | Create Your Own Garden Room Music Studio","https://www.buyshedsdirect.co.uk/sheds","shed","","","","Weak anchor",""
"","3","garden shed","https://www.buyshedsdirect.co.uk/blog/post/shed-roof-felt-replacement-guide","Shed Roof Felt Replacement Guide | Best Shed Roofing Material EPDM vs Felt","https://www.buyshedsdirect.co.uk/sheds","shed","","","","Weak anchor",""
"","3","garden shed","https://www.buyshedsdirect.co.uk/blog/post/care-and-maintenance-of-pressure-treated-wood","Best Practices for Maintaining & Protecting Pressure Treated Wood Using Treatments & Preservatives","https://www.buyshedsdirect.co.uk/sheds","sheds","","","","Weak anchor",""
"","3","garden shed","https://www.buyshedsdirect.co.uk/blog/post/how-to-store-bicycles-outside-garage-shed-and-without","How to Store Bicycles Outside | Bike Storage Ideas in Garages & Sheds","https://www.buyshedsdirect.co.uk/sheds","shed","","","","Weak anchor",""
"","3","garden shed","https://www.buyshedsdirect.co.uk/blog/post/installing-windows-in-a-shed-guide-replacement-advice","How to Install a Shed Window? Guide to Installing Windows in a Shed","https://www.buyshedsdirect.co.uk/sheds","shed","","","","Weak anchor",""
"","3","garden shed","https://www.buyshedsdirect.co.uk/blog/post/garden-ideas-small-spaces-space-saving-alternative-shed-storage","Space-Saving Garden Ideas for Small Spaces | Alternatives to Shed Storage","https://www.buyshedsdirect.co.uk/sheds","sheds","","","","Weak anchor",""
"","3","garden shed","https://www.buyshedsdirect.co.uk/blog/post/embracing-self-sufficiency-sustainability-and-off-grid-living","Self-Sufficiency, Sustainability & off grid Living | Solar Panel Sheds to Vegetable Gardens","https://www.buyshedsdirect.co.uk/sheds","sheds","","","","Weak anchor",""
"","3","garden shed","https://www.buyshedsdirect.co.uk/blog/post/how-to-apply-for-shed-planning-permission","Garden Building & Shed Planning Permission | Complete Guide & Tips","https://www.buyshedsdirect.co.uk/sheds","Garden sheds","","","","Strong link",""
"","3","garden shed","https://www.buyshedsdirect.co.uk/blog/post/when-is-the-best-time-of-year-to-use-a-greenhouse","When is the Best Time of Year to Use a Greenhouse | BSD Blog","https://www.buyshedsdirect.co.uk/sheds","sheds","","","","Weak anchor",""
"","3","garden shed","https://www.buyshedsdirect.co.uk/blog/post/creative-garden-ideas-and-hacks-to-transform-your-outdoor-space","Creative Garden Ideas & Hacks to Transform Your Outdoor Space","https://www.buyshedsdirect.co.uk/sheds","shed","","","","Weak anchor",""
"","3","garden shed","https://www.buyshedsdirect.co.uk/blog/post/waterproof-garden-canopy-ideas-sheds-small-gardens","15 Waterproof Garden Canopy Ideas for Small Gardens, Sheds & More","https://www.buyshedsdirect.co.uk/sheds","shed","","","","Weak anchor",""
"","3","garden shed","https://www.buyshedsdirect.co.uk/blog/post/solar-power-panel-ideas-for-the-garden","10 Solar Panel Ideas to Harness Solar Power in the Garden | Buy Sheds Direct","https://www.buyshedsdirect.co.uk/sheds","shed","","","","Weak anchor",""
"","3","garden shed","https://www.buyshedsdirect.co.uk/blog/post/love-is-all-around-the-garden-this-valentines-day","Love Is All Around the Garden on Valentine’s Day | BSD Blog","https://www.buyshedsdirect.co.uk/sheds","sheds","","","","Weak anchor",""
"","3","garden shed","https://www.buyshedsdirect.co.uk/blog/post/best-garden-storage-boxes","Best Garden Storage Boxes | Top Outdoor & Patio Storage Solutions","https://www.buyshedsdirect.co.uk/sheds","sheds","","","","Weak anchor",""
"","3","garden shed","https://www.buyshedsdirect.co.uk/blog/post/how-to-apply-for-shed-planning-permission","Garden Building & Shed Planning Permission | Complete Guide & Tips","https://www.buyshedsdirect.co.uk/sheds","Garden sheds","","","","Strong link",""
"","3","garden shed","https://www.buyshedsdirect.co.uk/blog/post/can-you-put-a-shed-on-gravel","Can You Put a Shed on Gravel? | Guide to Installing a Shed Base on Gravel","https://www.buyshedsdirect.co.uk/sheds","durable sheds","","","","Weak anchor",""
"","3","garden shed","https://www.buyshedsdirect.co.uk/blog/post/do-garden-offices-add-value-to-your-home","Do Garden Offices Add Value to Your Home? Best Garden Offices Ranked","https://www.buyshedsdirect.co.uk/sheds","Shed","","","","Weak anchor",""
"","3","garden shed","https://www.buyshedsdirect.co.uk/blog/post/creative-garden-seating-areas-ideas","12 Creative Garden Seating Areas, Ideas & Unique Outdoor Seating Tips","https://www.buyshedsdirect.co.uk/sheds","sheds","","","","Weak anchor",""
"","3","garden shed","https://www.buyshedsdirect.co.uk/blog/post/top-5-best-8x6-sheds","Top 5 Best 8x6 Sheds | Buy Sheds Direct Blog","https://www.buyshedsdirect.co.uk/sheds","here","","","","Weak anchor",""
"","2","garden shed","https://www.buyshedsdirect.co.uk/blog/post/using-osb-for-shed-walls-roofs","What Is OSB? Uses, Benefits & Strength for Shed Walls & Roofs","https://www.buyshedsdirect.co.uk/sheds","garden sheds","","","","Strong link",""
"","2","garden shed","https://www.buyshedsdirect.co.uk/blog/post/advice-on-choosing-a-shed","Advice on choosing a shed","https://www.buyshedsdirect.co.uk/sheds","Shop our range of garden sheds","","","","Strong link",""
"","2","garden shed","https://www.buyshedsdirect.co.uk/blog/post/what-type-of-shed-makes-the-best-garden-workshop","What Type of Shed Makes the Best Garden Workshop | BSD Blog","https://www.buyshedsdirect.co.uk/sheds","ALL of our sheds for sale here","","","","Strong link",""
"","2","garden shed","https://www.buyshedsdirect.co.uk/blog/post/how-to-use-paving-slabs-for-a-shed-base","How to use paving slabs for a shed base | Blog | Buy Sheds Direct","https://www.buyshedsdirect.co.uk/sheds","Shop our range of garden sheds","","","","Strong link",""
"","2","garden shed","https://www.buyshedsdirect.co.uk/blog/post/shed-choice-advice","Need a Little Advice in Choosing Your Shed | Blog | Buy Sheds Direct","https://www.buyshedsdirect.co.uk/sheds","View our superb range of sheds.","","","","Strong link",""
"","1","garden shed","https://www.buyshedsdirect.co.uk/blog/post/4-reasons-your-garden-deserves-a-palram-canopia-rubicon-shed","4 Reasons You Deserve a Palram Canopia Rubicon Shed | Buy Sheds Direct","https://www.buyshedsdirect.co.uk/sheds","","","","","Keyword not found",""
"","1","garden shed","https://www.buyshedsdirect.co.uk/blog/post/filling-large-planters-what-to-add-for-drainage","How to Fill a Large Planter & Bottom Drainage Tips | Buy Sheds Direct","https://www.buyshedsdirect.co.uk/sheds","","","","","Keyword not found",""
"","1","garden shed","https://www.buyshedsdirect.co.uk/blog/category/grow-your-own","Grow Your Own | Gardening Blogs | Garden Experts","https://www.buyshedsdirect.co.uk/sheds","","","","","Keyword not found",""
"","1","garden shed","https://www.buyshedsdirect.co.uk/blog/category/outdoor-living","Outdoor Living | Garden Lifestyle | Blogs","https://www.buyshedsdirect.co.uk/sheds","","","","","Keyword not found",""
"","1","garden shed","https://www.buyshedsdirect.co.uk/blog/category/summer-houses","Summer Houses | Garden Buildings | Blogs","https://www.buyshedsdirect.co.uk/sheds","","","","","Keyword not found",""
"","1","garden shed","https://www.buyshedsdirect.co.uk/blog/post/best-garage-storage-organisation-ideas","Best Garage Storage & Organisation Ideas | Buy Sheds Direct","https://www.buyshedsdirect.co.uk/sheds","","","","","Keyword not found",""
"","1","garden shed","https://www.buyshedsdirect.co.uk/blog/category/fencing","Fencing | Garden Fencing","https://www.buyshedsdirect.co.uk/sheds","","","","","Keyword not found",""
"","1","garden shed","https://www.buyshedsdirect.co.uk/blog/post/outdoor-lighting-ideas-for-gardens","15 Lighting Ideas for Gardens & Benefits | Guide to Outdoor Garden Lights","https://www.buyshedsdirect.co.uk/sheds","","","","","Keyword not found",""
"","1","garden shed","https://www.buyshedsdirect.co.uk/blog?page=4","Page 4 - The Buy Sheds Direct Blog","https://www.buyshedsdirect.co.uk/sheds","","","","","Keyword not found",""
"","1","garden shed","https://www.buyshedsdirect.co.uk/blog/category/garden-offices","Garden Offices | Garden Buildings | Blogs","https://www.buyshedsdirect.co.uk/sheds","","","","","Keyword not found",""
"","1","garden shed","https://www.buyshedsdirect.co.uk/blog/category/greenhouses","Greenhouses | Gardening | Blogs","https://www.buyshedsdirect.co.uk/sheds","","","","","Keyword not found",""
"","1","garden shed","https://www.buyshedsdirect.co.uk/blog/category/log-cabins","Log Cabins | Garden Buildings | Blogs","https://www.buyshedsdirect.co.uk/sheds","","","","","Keyword not found",""
"","1","garden shed","https://www.buyshedsdirect.co.uk/blog/category/playhouses","Playhouses | Children’s Playhouses | Blogs","https://www.buyshedsdirect.co.uk/sheds","","","","","Keyword not found",""
"","1","garden shed","https://www.buyshedsdirect.co.uk/blog/post/best-shed-cladding-options","Types of Shed Cladding & Options | Overlap vs Shiplap vs Tongue & Groove","https://www.buyshedsdirect.co.uk/sheds","","","","","Keyword not found",""
"","1","garden shed","https://www.buyshedsdirect.co.uk/blog/category/shed-advice?page=2","Page 2 - Shed Advice Blog Posts","https://www.buyshedsdirect.co.uk/sheds","","","","","Keyword not found",""
"","1","garden shed","https://www.buyshedsdirect.co.uk/blog/category/shed-advice?page=3","Page 3 - Shed Advice Blog Posts","https://www.buyshedsdirect.co.uk/sheds","","","","","Keyword not found",""
"","1","garden shed","https://www.buyshedsdirect.co.uk/blog/category/sheds?page=3","Page 3 - Sheds | Garden Sheds | Blogs","https://www.buyshedsdirect.co.uk/sheds","","","","","Keyword not found",""
"","1","garden shed","https://www.buyshedsdirect.co.uk/blog/category/sheds?page=4","Page 4 - Sheds | Garden Sheds | Blogs","https://www.buyshedsdirect.co.uk/sheds","","","","","Keyword not found",""
