"862jmu1hd","Eternals: Are the Deviants Really the Bad Guys? Who is the Real Villain?","[]","","","","",""
"862jmu1he","How Many Post-Credits Scenes are in Eternals?","[]","","","","",""
"862jmu1hf","Eternals: How Thanos' Snap Could Have Been Heroic","[]","","","","",""
"862jmu1hg","Eternals: Who is Dane Whitman and What is his Family's Secret?","[]","","","","",""
"862jmu1hh","Eternals: Who is Tiamut? Dreaming Celestial Explained.","[]","","","","",""
"862jmu1hj","Eternals: Who is Arishem the Judge?","[]","","","","",""
"862jmu1hk","Eternals: Who is Starfox, Harry Styles' Character Eros?","[]","","","","",""
"862jmu1hm","Eternals: What Happened to Ikaris in the End?","[]","","","","",""
"862jmu1hp","Eternals: What Happened to Sprite in the End?","[]","","","","",""
"862jmu1hq","Eternals: What Happened in Centauri-6?","[]","","","","",""
"862jmu1hr","Eternals: Who Lives, Who Dies?","[]","","","","",""
"862jmu1ht","Eternals: What is Mahd Wy'ry?","[]","","","","",""
"862jmu1hu","Eternals: Why Reviews are Low?","[]","","","","",""
"862jmu1hv","Eternals Ending Explained","[]","","","","",""
"862jmu1hw","Is Marvel's Eternals Worth Watching?","[]","","","","",""
"862jmu1hx","The Eternals Timeline Explained: Everything You Need to Know","[]","","","","",""
"862jmu1hy","New Marvel Spinoffs We Expect From The Eternals","[]","","","","",""
"862jmu1hz","Were The Eternals Blipped By Thanos? Here's The Surprising Answer From Director","[]","","","","",""
"1t2tn5t","Who is Moon  Knight? Does He Have Powers?","[]","","","","",""
"23zxn7z","Moon Knight COUNTDOWN: Episode 1, Premiere Date, Cast, Trailer, Plot, Reviews, and Everything You Need To Know","[]","","","","",""
"23zxna0","How Many Episodes Will Moon Knight Have and When are They Released on Disney Plus","[]","","","","",""
"23zxnbj","Is Moon Knight Releasing Weekly or All at Once?","[]","","","","",""
"23zxncw","Is Moon Knight Canon to the MCU?","[]","","","","",""
"23zxnfe","What Time Does Moon Knight Come Out? Release Time Revealed","[]","","","","",""
"23zxnga","What is the Plot of Moon Knight?","[]","","","","",""
"23zxnkg","Will Moon Knight Be on DVD or Blu-Ray and When Will It Be Released?","[]","","","","",""
"23zxnmc","What is Moon Knight Rated, Is it Safe for Kids to Watch? Everything You Need to Know","[]","","","","",""
"23zxnnc","Will Moon Knight Be in 4k on Disney Plus? How to Watch in the Highest Streaming Quality","[]","","","","",""
"23zxnq0","Moon Knight: Is It Out Yet on Disney Plus, Netflix, or Hulu? Where and When to Watch Stream","[]","","","","",""
"23zxnur","Moon Knight: Is Khonshu Real? (For when Khonshu is Introduced in the Series)","[]","","","","",""