Keyword,Volume,Keyword Difficulty,CPC (GBP),SERP Features
what is a pub quiz,140,4,0.00,"Sitelinks, AI Overview, Image, Video, Video carousel, Related searches"
what is pub quiz,110,9,0.00,"Sitelinks, AI Overview, Video, Video carousel, People also ask, Related searches"
how long does a pub quiz last,50,,0.00,
how to organize a pub quiz,20,,0.00,
how to write a good pub quiz,20,,0.00,
what year pub quiz questions,20,,0.00,
how to create a good pub quiz,10,,0.00,
what am i pub quiz questions,10,,0.00,
can pub quiz be a hobby on cv,0,,0.00,
can you charge for a pub quiz,0,,0.00,
can you charge for a pub quiz,0,,0.00,
do they pub quizs in canada,0,,0.00,
how british are you pub quiz,0,,0.00,
how british are you pub quiz,0,,0.00,
how does a zoom pub quiz work,0,,0.00,
how long are pub quizes,0,,0.00,
how long does a pub quiz take,0,,0.00,
how long does a pub quiz take,0,,0.00,
how to aim a pub quiz,0,,0.00,
how to be a good pub quiz host,0,,0.00,
how to build a pub quiz,0,,0.00,
how to build a pub quiz,0,,0.00,
how to build a pub quiz,0,,0.00,
how to correct pub quiz,0,,0.00,
how to describe pub quiz,0,,0.00,
how to hold a virtual pub quiz,0,,0.00,
how to join pub quiz yogscast,0,,0.00,
how to make a fun pub quiz,0,,0.00,
how to make a great pub quiz,0,,0.00,
how to make the best pub quiz,0,,0.00,
how to mark a virtual pub quiz,0,,0.00,
how to play virtual pub quiz,0,,0.00,
how to run a great pub quiz,0,,0.00,
how to score a pub quiz,0,,0.00,
how to score a pub quiz,0,,0.00,
how to set up pub quiz on zoom,0,,0.00,
is a pub quiz gambling,0,,0.00,
is a pub quiz gambling,0,,0.00,
is pub quiz the same as trivia,0,,0.00,
what happened next pub quiz,0,,0.00,
what is a ringer pub quiz,0,,0.00,
what is the origin of pub quiz,0,,0.00,
what night is coborn pub quiz,0,,0.00,
