"https://ten10.com/blog/upskill-and-reskill-your-employees/","text/html; charset=UTF-8","200","OK","Indexable","","Effective ways to upskill and reskill your employees | Ten10","60","523","Read how you can close your organisation’s tech skills gap by upskilling and reskilling your employees into the talent you need.","128","798","","0","Effective ways to upskill and reskill your employees","52","Close your organisation’s tech skills gap by upskilling and reskilling your existing staff","90","Ready to reap the benefits of upskilling and reskilling your workforce?","71","index, follow, max-image-preview:large, max-snippet:-1, max-video-preview:-1","","","https://ten10.com/blog/upskill-and-reskill-your-employees/","","","","","","129408","34568","34568","13.242","","1909","256","7.457","57.631","Fairly Hard","10.081","4","2","","20","5","0","1.170","83","37","0","9","6","0","","","","","f685018d11136ed4410b5ca762ab456e","0.016","","","","","en-GB","1.1","","","","","","https://ten10.com/blog/upskill-and-reskill-your-employees/","2026-02-03 09:56:17"
"https://ten10.com/case-studies/innovative-test-automation-factory-enables-confidence-for-mobile-release/","text/html; charset=UTF-8","200","OK","Indexable","","Case Study: Innovative Test Automation Factory | Ten10","54","495","Learn how our innovative Test Automation Factory helped a multinational fintech business increase test coverage and improve their quality assurance.","148","954","","0","Innovative Test Automation Factory enables confidence for mobile release","72","What we did","11","Challenges","10","index, follow, max-image-preview:large, max-snippet:-1, max-video-preview:-1","","","https://ten10.com/case-studies/innovative-test-automation-factory-enables-confidence-for-mobile-release/","","","","","","124278","32105","32105","12.299","","1392","200","6.960","52.936","Fairly Hard","7.969","4","2","","22","7","0","1.640","80","37","0","7","5","0","","","","","a2ffd8fcc737e3ff1dd065ec0c5b2ce6","0.325","","","","","en-GB","1.1","","","","","","https://ten10.com/case-studies/innovative-test-automation-factory-enables-confidence-for-mobile-release/","2026-02-03 09:56:17"
"https://ten10.com/blog/what-is-hyperautomation/","text/html; charset=UTF-8","200","OK","Indexable","","What is hyperautomation? | Ten10","32","302","Learn the differences between hyperautomation, RPA, and IA, and how they can be combined to increase operational effectiveness.","127","835","","0","What is hyperautomation?","24","Robotic Process Automation vs. Hyperautomation","46","Make the most of hyperautomation with our experts","49","index, follow, max-image-preview:large, max-snippet:-1, max-video-preview:-1","","","https://ten10.com/blog/what-is-hyperautomation/","","","","","","124615","33086","33086","12.675","","1553","245","6.339","35.723","Hard","9.302","4","2","","20","5","0","1.170","80","35","0","7","5","0","","","","","c3d237eb89c9475893d8663bfd46bb53","0.016","","","","","en-GB","1.1","","","","","","https://ten10.com/blog/what-is-hyperautomation/","2026-02-03 09:56:18"
"https://ten10.com/whitepapers/devops-best-practices-checklist/","text/html; charset=UTF-8","200","OK","Indexable","","DevOps best practices checklist | Ten10","39","352","Keep your DevOps transformation on the right track and feel the full benefit of successfully adopting DevOps with our top ten best practices.","141","883","","0","DevOps best practices checklist","31","Follow these ten DevOps best practices to set your business up for success","74","Need Cloud or DevOps expertise with cost-effective and pragmatic solutions?","75","index, follow, max-image-preview:large, max-snippet:-1, max-video-preview:-1","","","https://ten10.com/whitepapers/devops-best-practices-checklist/","","","","","","137439","38168","38168","14.621","","3844","527","7.294","68.746","Normal","17.177","4","2","","20","5","0","1.170","81","37","0","7","5","0","","","","","ccd6286044ba66bb8ed9730c9781819d","0.319","","","","","en-GB","1.1","","","","","","https://ten10.com/whitepapers/devops-best-practices-checklist/","2026-02-03 09:56:17"
"https://ten10.com/blog/how-to-prove-return-on-investment-in-ai/","text/html; charset=UTF-8","200","OK","Indexable","","How to prove return on investment in AI | Ten10","47","418","Market hype surrounding AI has amplified the pressure to prove its ROI. Learn how to prove return on AI investment with this free guide.","136","858","","0","How to prove return on investment in AI","39","Understanding ROI in AI","23","Did you know?","13","index, follow, max-image-preview:large, max-snippet:-1, max-video-preview:-1","","","https://ten10.com/blog/how-to-prove-return-on-investment-in-ai/","","","","","","128531","34421","34421","13.186","","2037","305","6.679","40.865","Hard","11.463","4","2","","24","9","0","2.110","82","36","0","9","6","0","","","","","a5f63eec05e3022ae7e188f8bfb5de3f","0.317","","","","","en-GB","1.1","","","","","","https://ten10.com/blog/how-to-prove-return-on-investment-in-ai/","2026-02-03 09:56:18"
"https://ten10.com/case-studies/fully-flexible-off-site-agile-testing/","text/html; charset=UTF-8","200","OK","Indexable","","Fully flexible off-site Agile testing | Ten10","45","362","Read how a leading inter-dealer broker used our flexible testing team, allowing them to adjust the size of their team based on requirements.","140","882","","0","Fully flexible off-site Agile testing","37","High Quality Testers With Capital Markets Expertise","51","Off-Site Yet Accessible","23","index, follow, max-image-preview:large, max-snippet:-1, max-video-preview:-1","","","https://ten10.com/case-studies/fully-flexible-off-site-agile-testing/","","","","","","121177","31115","31115","11.920","","1075","164","6.555","56.086","Fairly Hard","6.445","4","2","","23","8","0","1.880","79","36","0","7","5","0","","","","","8f917fdc3b4336d48d937daec3425315","0.012","","","","","en-GB","1.1","","","","","","https://ten10.com/case-studies/fully-flexible-off-site-agile-testing/","2026-02-03 09:56:18"
"https://ten10.com/blog/meet-our-academy-consultants-ashis-budha-magar/","text/html; charset=UTF-8","200","OK","Indexable","","Meet our Academy Consultants - Ashis Budha Magar | Ten10","56","538","Read about Ashis Budha Magar's career transformation, from studying Architecture to becoming an RPA Developer in the Legal sector.","130","852","","0","Meet our Academy Consultants – Ashis Budha Magar","48","Read about Ashis’ career transformation, from studying Architecture to becoming an RPA Developer in the Legal sector","116","Bring new talent into your organisation without having to wait","62","index, follow, max-image-preview:large, max-snippet:-1, max-video-preview:-1","","","https://ten10.com/blog/meet-our-academy-consultants-ashis-budha-magar/","","","","","","127509","34058","34058","13.047","","2009","270","7.441","68.782","Normal","10.076","4","2","","21","6","0","1.410","80","35","0","7","5","0","","","","","648eac5d64b10845078b3dd4b70ab539","0.014","","","","","en-GB","1.1","","","","","","https://ten10.com/blog/meet-our-academy-consultants-ashis-budha-magar/","2026-02-03 09:56:18"
"https://ten10.com/case-studies/programme-test-management-in-a-multi-vendor-role/","text/html; charset=UTF-8","200","OK","Indexable","","Programme test management in a multi-vendor role | Ten10","56","526","Read how Ten10 helped a customer review a large scale integration project that was running four months behind schedule and implement best practice.","147","963","","0","Programme test management in a multi-vendor role","48","How you can achieve the same results","36","Latest Insights","15","index, follow, max-image-preview:large, max-snippet:-1, max-video-preview:-1","","","https://ten10.com/case-studies/programme-test-management-in-a-multi-vendor-role/","","","","","","124014","31946","31946","12.238","","1181","172","6.866","54.950","Fairly Hard","6.804","4","2","","22","7","0","1.640","81","36","0","7","5","0","","","","","8739746d6af5068dafa23fb87a9d822b","0.311","","","","","en-GB","1.1","","","","","","https://ten10.com/case-studies/programme-test-management-in-a-multi-vendor-role/","2026-02-03 09:56:18"
"https://ten10.com/category/blog/page/19/","text/html; charset=UTF-8","200","OK","Indexable","","Blog Archives | Page 19 of 20 | Ten10","37","329","Get expert insights from a consultancy team with decades of experience, including e-guides, webinars, whitepapers and case studies of Ten10's previous work.","156","1006","","0","Blog","4","Posts pagination","16","","0","index, follow, max-image-preview:large, max-snippet:-1, max-video-preview:-1","","","https://ten10.com/category/blog/page/19/","https://ten10.com/category/blog/page/20/","https://ten10.com/category/blog/page/18/","","","","119529","27702","27702","10.612","","601","105","5.724","50.969","Fairly Hard","4.056","4","4","","19","3","0","0.700","100","40","0","7","5","0","","","","","5db219da05b50c1ba270300ce854f13e","0.330","","","","","en-GB","1.1","","","","","","https://ten10.com/category/blog/page/19/","2026-02-03 09:56:18"
"https://ten10.com/podcast/female-tech-leaders-interview-with-damola-odusolu/","text/html; charset=UTF-8","200","OK","Indexable","","Female Tech Leaders: Interview with Damola Odusolu | Ten10","58","544","Hear from Damola Odusolu as she explains her 'zigzag' career path into tech and her advice for people trying to make a career change.","133","849","","0","Female Tech Leaders: Interview with Damola Odusolu","50","Hear from Damola Odusolu, Senior Product Manager at Kin + Carta","63","Read more amazing career stories","32","index, follow, max-image-preview:large, max-snippet:-1, max-video-preview:-1","","","https://ten10.com/podcast/female-tech-leaders-interview-with-damola-odusolu/","","","","","","134982","37722","37722","14.451","","3416","412","8.291","74.714","Fairly Easy","15.206","4","2","","21","5","0","1.170","80","36","0","8","6","0","","","","","6f3731871af8f1a93049e9f239d9ced","0.013","","","","","en-GB","1.1","","","","","","https://ten10.com/podcast/female-tech-leaders-interview-with-damola-odusolu/","2026-02-03 09:56:18"
"https://ten10.com/blog/in-software-delivery-can-speed-and-quality-coexist/","text/html; charset=UTF-8","200","OK","Indexable","","In software delivery, can speed and quality coexist? | Ten10","60","522","What needs to be in place to ensure speed and quality coexist when delivering software? Read what our panel of experts have to say.","131","842","","0","In software delivery, can speed and quality coexist?","52","Learn how to balance speed and quality in software delivery","59","Latest Insights","15","index, follow, max-image-preview:large, max-snippet:-1, max-video-preview:-1","","","https://ten10.com/blog/in-software-delivery-can-speed-and-quality-coexist/","","","","","","131005","33433","33433","12.808","","1450","219","6.621","71.464","Fairly Easy","7.200","4","2","","20","5","0","1.170","79","36","0","8","6","0","","","","","1b07399eeefc8fa5b54da2ab8a127bbf","0.351","","","","","en-GB","1.1","","","","","","https://ten10.com/blog/in-software-delivery-can-speed-and-quality-coexist/","2026-02-03 09:56:18"
"https://ten10.com/blog/my-journey-into-aws/","text/html; charset=UTF-8","200","OK","Indexable","","Margaret Walker - My journey into AWS | Ten10","45","414","Meet Margaret Walker, who joined the Ten10 DOCP team through our award-winning Academy and in now flourishing in her new IT career using AWS.","141","948","","0","Margaret Walker – My journey into AWS","37","Level up your DevOps, Cloud and Platform Engineering projects","61","Latest Insights","15","index, follow, max-image-preview:large, max-snippet:-1, max-video-preview:-1","","","https://ten10.com/blog/my-journey-into-aws/","","","","","","119953","31374","31374","12.019","","1189","172","6.913","58.724","Fairly Hard","6.938","4","2","","20","5","0","1.170","79","35","0","7","5","0","","","","","659371b2dc892a25d902044f605c8f3d","0.012","","","","","en-GB","1.1","","","","","","https://ten10.com/blog/my-journey-into-aws/","2026-02-03 09:56:18"
"https://ten10.com/case-studies/early-optimisation-of-systems-through-early-performance-testing/","text/html; charset=UTF-8","200","OK","Indexable","","Early optimisation of systems through early performance testing | Ten10","71","638","Read how we helped a Professional Services company develop a new SaaS, including improving their system response times by 40%.","126","843","","0","Early optimisation of systems through early performance testing","63","How you can achieve the same results","36","Latest Insights","15","index, follow, max-image-preview:large, max-snippet:-1, max-video-preview:-1","","","https://ten10.com/case-studies/early-optimisation-of-systems-through-early-performance-testing/","","","","","","127871","32586","32586","12.483","","1324","194","6.825","53.583","Fairly Hard","7.457","4","2","","22","7","0","1.640","81","36","0","7","5","0","","","","","f458a9223e0ef683d74f42cf9b5e8e57","0.012","","","","","en-GB","1.1","","","","","","https://ten10.com/case-studies/early-optimisation-of-systems-through-early-performance-testing/","2026-02-03 09:56:18"
"https://ten10.com/blog/meet-our-academy-consultants-jeet-dandy/","text/html; charset=UTF-8","200","OK","Indexable","","Meet our Academy Consultants - Jeet Dandy | Ten10","49","463","Meet Jeet Dandy and learn how he's helping his client save time by enabling automation across many business teams.","114","751","","0","Meet our Academy Consultants – Jeet Dandy","41","Meet Jeet Dandy and learn how he’s helping his client save time by enabling automation across many business teams.","114","Bring new talent into your organisation without having to wait","62","index, follow, max-image-preview:large, max-snippet:-1, max-video-preview:-1","","","https://ten10.com/blog/meet-our-academy-consultants-jeet-dandy/","","","","","","128381","34422","34422","13.186","","2153","287","7.502","75.327","Fairly Easy","10.446","4","2","","21","6","0","1.410","81","36","0","7","5","0","","","","","49ebb8f857743a8c49e0cfc072c1b7e8","0.321","","","","","en-GB","1.1","","","","","","https://ten10.com/blog/meet-our-academy-consultants-jeet-dandy/","2026-02-03 09:56:18"
"https://ten10.com/podcast/transition-from-training-to-client-work/","text/html; charset=UTF-8","200","OK","Indexable","","How do you transition from training to client work? | Ten10","59","516","Hear what it's like to complete the Ten10 Academy training and then make the transition to joining a client workplace and its tech team.","136","856","","0","How do you transition from training to client work?","51","Hear how our Academy Consultants transition from training into the workplace","76","See how we train the next generation of technologists","53","index, follow, max-image-preview:large, max-snippet:-1, max-video-preview:-1","","","https://ten10.com/podcast/transition-from-training-to-client-work/","","","","","","127098","34078","34078","13.055","","2234","299","7.472","80.228","Easy","10.587","4","2","","21","5","0","1.170","80","35","0","7","5","0","","","","","9689d3a57395061ef7da225dd3710aca","0.012","","","","","en-GB","1.1","","","","","","https://ten10.com/podcast/transition-from-training-to-client-work/","2026-02-03 09:56:19"
"https://ten10.com/insights/?_sft_category=case-studies&_sft_solution=test-automation","text/html; charset=UTF-8","200","OK","Non-Indexable","Canonicalised","Insights | Ten10","16","142","Read Ten10's expert insights, including blogs, webinars and whitepapers from our technical consultants across a wide range of industries.","137","870","","0","Insights","8","Learn more","10","Increasing rate of delivery for Motability Operations through test automation","77","index, follow, max-image-preview:large, max-snippet:-1, max-video-preview:-1","","","https://ten10.com/insights/","","","","","","120855","30482","30482","11.677","","711","151","4.709","41.066","Hard","4.717","4","1","","16","2","0","0.470","70","33","0","7","5","0","","","","","ae4a9daff75870e79f9d244e57aa8c8a","0.308","","","","","en-GB","1.1","","","","","","https://ten10.com/insights/?_sft_category=case-studies&_sft_solution=test-automation","2026-02-03 09:56:19"
"https://ten10.com/blog/meet-our-academy-consultants-hashan-sugu/","text/html; charset=UTF-8","200","OK","Indexable","","Meet our Academy Consultants - Hashan Sugu | Ten10","50","484","Read about Hashan Sugu's first year in tech, completing projects for a chemical company and owning his development into a project manager.","138","899","","0","Meet our Academy Consultants – Hashan Sugu","42","Read about Hashan Sugu’s first year in tech, completing projects for a chemical company and owning his development into a project manager","137","Bring new talent into your organisation without having to wait","62","index, follow, max-image-preview:large, max-snippet:-1, max-video-preview:-1","","","https://ten10.com/blog/meet-our-academy-consultants-hashan-sugu/","","","","","","130656","35917","35917","13.759","","2741","345","7.945","75.744","Fairly Easy","12.641","4","2","","21","6","0","1.410","80","35","0","7","5","0","","","","","b7f75601d057a74fb32630171c9b46f3","0.441","","","","","en-GB","1.1","","","","","","https://ten10.com/blog/meet-our-academy-consultants-hashan-sugu/","2026-02-03 09:56:19"
"https://ten10.com/podcast/female-tech-leaders-interview-with-levina-basra/","text/html; charset=UTF-8","200","OK","Indexable","","Female Tech Leaders: Interview with Levina Basra | Ten10","56","511","Hear from Levina Basra as she tells us about her career, being self-taught in the world of tech, and what it's like working at a scale-up.","138","842","","0","Female Tech Leaders: Interview with Levina Basra","48","Hear from Levina Basra, Product Manager at cinch","48","Read more amazing career stories","32","index, follow, max-image-preview:large, max-snippet:-1, max-video-preview:-1","","","https://ten10.com/podcast/female-tech-leaders-interview-with-levina-basra/","","","","","","128732","34591","34591","13.251","","2319","314","7.385","71.107","Fairly Easy","11.284","4","2","","21","5","0","1.170","80","36","0","9","7","0","","","","","cff15a993fab2857c36dd3c633c88e7f","0.015","","","","","en-GB","1.1","","","","","","https://ten10.com/podcast/female-tech-leaders-interview-with-levina-basra/","2026-02-03 09:56:20"
"https://ten10.com/blog/what-is-integration-testing","text/html; charset=UTF-8","301","Moved Permanently","Non-Indexable","Redirected","","0","0","","0","0","","0","","0","","0","","0","","","","","","","","","","0","0","0","0.000","","0","","","","","0.000","4","1","","1","1","0","0.230","0","0","0","0","0","0","","","","","","0.139","","https://ten10.com/blog/what-is-integration-testing/","HTTP Redirect","","","1.1","","","","","","https://ten10.com/blog/what-is-integration-testing","2026-02-03 09:56:20"
"https://ten10.com/blog/meet-our-academy-engineers-amelia-nock/","text/html; charset=UTF-8","200","OK","Indexable","","Meet our Academy Consultants - Amelia Nock | Ten10","50","477","Read how Amelia’s passion for personal development started her career in manual testing with the Ten10 Academy.","111","737","","0","Meet our Academy Consultants – Amelia Nock","42","Read how Amelia’s passion for personal development started her career in manual testing with Ten10","98","Project 1","9","index, follow, max-image-preview:large, max-snippet:-1, max-video-preview:-1","","","https://ten10.com/blog/meet-our-academy-engineers-amelia-nock/","","","","","","127109","33707","33707","12.913","","1779","260","6.842","60.507","Normal","9.414","4","2","","21","6","0","1.410","81","37","0","7","5","0","","","","","f73b11eab8728242f4a372157365b7c6","0.012","","","","","en-GB","1.1","","","","","","https://ten10.com/blog/meet-our-academy-engineers-amelia-nock/","2026-02-03 09:56:20"
"https://ten10.com/blog/international-womens-day-meet-maariyah/","text/html; charset=UTF-8","200","OK","Indexable","","International Women’s Day – Meet Maariyah | Ten10","49","463","Hear from Maariyah as she explains why she went into the tech industry and how other women have inspired her to be where she is.","128","837","","0","International Women’s Day – Meet Maariyah","41","Can you tell us a little bit about you and your role at Ten10?","62","What drew you into the tech industry?","37","index, follow, max-image-preview:large, max-snippet:-1, max-video-preview:-1","","","https://ten10.com/blog/international-womens-day-meet-maariyah/","","","","","","120097","30943","30943","11.854","","1069","156","6.853","62.256","Normal","6.144","5","2","","20","5","0","1.170","78","35","0","7","5","0","","","","","1a2b86aa8992d1916795938cf7e73e2f","0.293","","","","","en-GB","1.1","","","","","","https://ten10.com/blog/international-womens-day-meet-maariyah/","2026-02-03 09:56:20"
"https://ten10.com/blog/embracing-platform-engineering-for-efficiency-and-governance/","text/html; charset=UTF-8","200","OK","Indexable","","Embracing platform engineering for efficiency and governance | Ten10","68","622","Learn how to increase flexibility and decrease the risk of non-compliance by successfully implementing platform engineering.","124","791","","0","Embracing platform engineering for efficiency and governance","60","Foundation for success","22","Scalability and flexibility","27","index, follow, max-image-preview:large, max-snippet:-1, max-video-preview:-1","","","https://ten10.com/blog/embracing-platform-engineering-for-efficiency-and-governance/","","","","","","126059","33185","33185","12.713","","1810","247","7.328","62.962","Normal","9.460","5","2","","20","5","0","1.170","80","35","0","7","5","0","","","","","2b3a9632a2ea0f3013c6da0113f8a219","0.312","","","","","en-GB","1.1","","","","","","https://ten10.com/blog/embracing-platform-engineering-for-efficiency-and-governance/","2026-02-03 09:56:20"
"https://ten10.com/webinars/test-resource-planning/","text/html; charset=UTF-8","200","OK","Indexable","","Test resource planning | Ten10","30","273","Watch our free webinar on test resource planning, discussing the key issues that influence your test resource planning.","119","750","","0","Test resource planning","22","Latest Insights","15","","0","index, follow, max-image-preview:large, max-snippet:-1, max-video-preview:-1","","","https://ten10.com/webinars/test-resource-planning/","","","","","","116757","29886","29886","11.449","","762","130","5.862","56.999","Fairly Hard","4.923","5","2","","20","5","0","1.170","78","35","0","7","5","0","","","","","f4011186482e0753904712fa7f67f7b8","0.014","","","","","en-GB","1.1","","","","","","https://ten10.com/webinars/test-resource-planning/","2026-02-03 09:56:21"
"https://ten10.com/blog/fundamentals-of-effective-finops-implementation/","text/html; charset=UTF-8","200","OK","Indexable","","The fundamentals of effective FinOps implementation | Ten10","59","549","Ten10's DOCP consultants give you five essential tips for implementing FinOps and controlling cloud expenses.","109","701","","0","The fundamentals of effective FinOps implementation","51","Our DevOps, Cloud and Platform consultants give you five essential tips for implementing FinOps and controlling cloud expenses","126","Speak to an expert consultant","29","index, follow, max-image-preview:large, max-snippet:-1, max-video-preview:-1","","","https://ten10.com/blog/fundamentals-of-effective-finops-implementation/","","","","","","121885","31921","31921","12.228","","1467","215","6.823","64.619","Normal","8.049","5","2","","20","5","0","1.170","79","35","0","7","5","0","","","","","79020527cfa0551b7adc6cf369c76aa3","0.012","","","","","en-GB","1.1","","","","","","https://ten10.com/blog/fundamentals-of-effective-finops-implementation/","2026-02-03 09:56:21"
"https://ten10.com/blog/5-uses-for-rpa-in-financial-services/","text/html; charset=UTF-8","200","OK","Indexable","","5 uses for RPA in financial services | Ten10","44","381","Learn how RPA can help financial companies avoid costly mistakes and streamline workflows while remaining compliant.","116","766","","0","5 uses for RPA in financial services","36","Why should RPA be used in finance?","34","Use #1: Achieve growth without compromising older systems","57","index, follow, max-image-preview:large, max-snippet:-1, max-video-preview:-1","","","https://ten10.com/blog/5-uses-for-rpa-in-financial-services/","","","","","","127395","33358","33358","12.779","","1548","222","6.973","53.511","Fairly Hard","8.492","5","2","","20","5","0","1.170","84","40","0","10","8","0","","","","","d2af1b72f792eefaea82f7d4d08b0770","0.013","","","","","en-GB","1.1","","","","","","https://ten10.com/blog/5-uses-for-rpa-in-financial-services/","2026-02-03 09:56:21"
"https://ten10.com/blog/international-womens-day-meet-rebecca-williams/","text/html; charset=UTF-8","200","OK","Indexable","","International Women’s Day – Meet Rebecca Williams | Ten10","57","537","Hear from Rebecca Williams as she explains why she went into the tech industry and how other women have inspired her to be where she is.","136","889","","0","International Women’s Day – Meet Rebecca Williams","49","Can you tell us a little bit about you and your role at Ten10?","62","What drew you into the tech industry?","37","index, follow, max-image-preview:large, max-snippet:-1, max-video-preview:-1","","","https://ten10.com/blog/international-womens-day-meet-rebecca-williams/","","","","","","121139","31414","31414","12.034","","1152","170","6.776","60.279","Normal","6.564","5","2","","20","5","0","1.170","78","35","0","7","5","0","","","","","76c2f60c7a600ebcbb22b6c06e874bdb","0.046","","","","","en-GB","1.1","","","","","","https://ten10.com/blog/international-womens-day-meet-rebecca-williams/","2026-02-03 09:56:21"
