"https://ten10.com/consultancy/software-testing-services/","text/html; charset=UTF-8","301","Moved Permanently","Non-Indexable","Redirected","","0","0","","0","0","","0","","0","","0","","0","","","","","","","","","","0","0","0","0.000","","0","","","","","0.000","2","2","","13","12","0","2.820","0","0","0","0","0","0","","","","","","0.033","","https://ten10.com/consultancy/software-testing-quality-assurance-services/","HTTP Redirect","","","1.1","","","","","","https://ten10.com/consultancy/software-testing-services/","2026-02-03 09:55:47"
"https://ten10.com/blog/how-devops-can-take-advantage-of-ai/","text/html; charset=UTF-8","200","OK","Indexable","","How DevOps can take advantage of AI | Ten10","43","410","Learn how you can leverage the power of AI to optimise DevOps practices and deliver better software products faster and more reliably.","134","858","","0","How DevOps can take advantage of AI","35","Learn how you can leverage the power of AI to optimise DevOps practices","71","People also ask","15","index, follow, max-image-preview:large, max-snippet:-1, max-video-preview:-1","","","https://ten10.com/blog/how-devops-can-take-advantage-of-ai/","","","","","","124725","32613","32613","12.493","","1467","225","6.520","44.108","Hard","8.552","2","2","","24","9","0","2.110","84","39","0","7","5","0","","","","","459975121fe8e7b88314734e88a6562c","0.312","","","","","en-GB","1.1","","","","","","https://ten10.com/blog/how-devops-can-take-advantage-of-ai/","2026-02-03 09:55:46"
"https://ten10.com/blog/balancing-speed-and-oversight-with-review-first-test-generation/","text/html; charset=UTF-8","200","OK","Indexable","","Balancing speed and oversight with review-first test generation | Ten10","71","625","Discover why review-first test generation has emerged as a strategic way for organisations to scale while ensuring software quality.","132","833","","0","Balancing speed and oversight with review-first test generation","63","The importance of continuous quality","36","The importance of human expertise","33","index, follow, max-image-preview:large, max-snippet:-1, max-video-preview:-1","","","https://ten10.com/blog/balancing-speed-and-oversight-with-review-first-test-generation/","","","","","","126435","33154","33154","12.701","","1613","240","6.721","50.167","Fairly Hard","9.062","2","2","","20","5","0","1.170","81","35","0","7","5","0","","","","","2d5844c2ce3dec6ad7cd28a5f78c5691","0.012","","","","","en-GB","1.1","","","","","","https://ten10.com/blog/balancing-speed-and-oversight-with-review-first-test-generation/","2026-02-03 09:55:47"
"https://ten10.com/blog/what-does-speed-mean-in-software-delivery/","text/html; charset=UTF-8","200","OK","Indexable","","What does 'speed' mean in software delivery? | Ten10","52","470","How do you measure software delivery speed? And how can accelerating affect your business? Our expert panel explains what you need to know.","139","922","","0","What does ‘speed’ mean in software delivery?","44","Learn how to balance speed and quality in software delivery","59","Latest Insights","15","index, follow, max-image-preview:large, max-snippet:-1, max-video-preview:-1","","","https://ten10.com/blog/what-does-speed-mean-in-software-delivery/","","","","","","134267","35030","35030","13.419","","1990","265","7.509","71.633","Fairly Easy","9.368","2","2","","23","8","0","1.880","79","36","0","8","6","0","","","","","728d2008a3653e79300286992915674a","0.358","","","","","en-GB","1.1","","","","","","https://ten10.com/blog/what-does-speed-mean-in-software-delivery/","2026-02-03 09:55:47"
"https://ten10.com/quality-test-leadership/","text/html; charset=UTF-8","200","OK","Indexable","","Quality & Test Leadership Consultancy | Ten10","45","411","Ten10's Quality & Test Leadership Services offer established processes, templates, and tools to ensure confident software updates,both now and in the future.","157","1004","","0","Quality & Test Leadership Consultancy","37","Why Ten10?","10","Speak to a member of our team about Quality Engineering today","61","index, follow, max-image-preview:large, max-snippet:-1, max-video-preview:-1","","","https://ten10.com/quality-test-leadership/","","","","","","134995","37036","37036","14.188","","1051","153","6.869","52.074","Fairly Hard","5.717","2","1","","18","4","0","0.940","71","29","0","7","5","0","","","","","f509b96f90f46b69577aece1a37397e1","0.366","","","","","en-GB","1.1","","","","","","https://ten10.com/quality-test-leadership/","2026-02-03 09:55:47"
"https://ten10.com/blog/why-software-testing-just-became-the-most-important-skill-in-technology/","text/html; charset=UTF-8","200","OK","Indexable","","Why software testing just became the most important skill in technology | Ten10","79","709","Ash Gawthorp, Ten10's CTO, discusses why the rise of AI agents proves the lasting importance of software testing skills.","120","762","","0","Why software testing just became the most important skill in technology","71","Ash Gawthorp, Ten10’s Chief Technology Officer, discusses why the recent rise of AI agents proves the lasting importance of software testing skills in the modern tech workforce","176","The admission that validated an industry’s anxiety","50","index, follow, max-image-preview:large, max-snippet:-1, max-video-preview:-1","","","https://ten10.com/blog/why-software-testing-just-became-the-most-important-skill-in-technology/","","","","","","146863","40061","40061","15.347","","3307","541","6.113","51.333","Fairly Hard","15.782","2","2","","626","305","0","71.600","78","32","0","9","7","0","","","","","9f0578c88d47f740640d7446361a96","0.012","","","","","en-GB","1.1","","","","","","https://ten10.com/blog/why-software-testing-just-became-the-most-important-skill-in-technology/","2026-02-03 09:55:47"
"https://ten10.com/blog/how-business-analysis-helps-you-overcome-business-challenges/","text/html; charset=UTF-8","200","OK","Indexable","","How business analysis helps you overcome business challenges | Ten10","68","642","Feeling held back? Learn how effective business analysis can transform a struggling business into a thriving one.","113","713","","0","How business analysis helps you overcome business challenges","60","1. “We have a disconnect between business and IT stakeholders.”","63","2. “We need to better understand our data and how to use it for decision-making.”","81","index, follow, max-image-preview:large, max-snippet:-1, max-video-preview:-1","","","https://ten10.com/blog/how-business-analysis-helps-you-overcome-business-challenges/","","","","","","128434","33086","33086","12.675","","1515","251","6.036","35.362","Hard","8.949","2","2","","21","6","0","1.410","79","35","0","7","5","0","","","","","54a7e82a15079c1511e27f8520e05d7f","0.325","","","","","en-GB","1.1","","","","","","https://ten10.com/blog/how-business-analysis-helps-you-overcome-business-challenges/","2026-02-03 09:55:47"
"https://ten10.com/consultancy/robotic-process-automation-services/rpa-pilot/","text/html; charset=UTF-8","200","OK","Indexable","","Robotic Process Automation (RPA) Pilot Services | Ten10","55","504","Ten10’s RPA Pilot provides a low-cost, low-risk approach to introducing RPA into your organisation without longer-term service, licence or tooling commitments.","159","1006","","0","Robotic Process Automation (RPA) Pilot Services","47","Why Ten10?","10","Ten10 at a glance","17","index, follow, max-image-preview:large, max-snippet:-1, max-video-preview:-1","","","https://ten10.com/consultancy/robotic-process-automation-services/rpa-pilot/","","","","","","149343","40437","40437","15.491","","1794","260","6.900","43.694","Hard","8.708","2","3","","19","5","0","1.170","78","32","0","7","5","0","","","","","cf71459b35274437a797adb31a757cf1","0.329","","","","","en-GB","1.1","","","","","","https://ten10.com/consultancy/robotic-process-automation-services/rpa-pilot/","2026-02-03 09:55:48"
"https://ten10.com/compatibility-testing/","text/html; charset=UTF-8","200","OK","Indexable","","Device and Browser Compatibility Testing | Ten10","48","438","Learn how our expert device and browser compatibility testing consultancy is helping organisations meet ever-increasing customer expectations.","142","918","","0","Device and Browser Compatibility Testing","40","Compatibility testing ensures that software will meet ever-increasing customer expectations across a broad range of devices, operating systems and browsers.","156","Overview","8","index, follow, max-image-preview:large, max-snippet:-1, max-video-preview:-1","","","https://ten10.com/compatibility-testing/","","","","","","117436","31066","31066","11.901","","1121","168","6.673","49.201","Hard","6.880","2","1","","20","6","0","1.410","68","29","0","7","5","0","","","","","4d98433fb6dfb6672de2430c7f527b5","0.341","","","","","en-GB","1.1","","","","","","https://ten10.com/compatibility-testing/","2026-02-03 09:55:48"
"https://ten10.com/company/corporate-and-social-responsibility/gender-pay-gap/","text/html; charset=UTF-8","200","OK","Indexable","","Gender Pay Gap | Ten10","22","213","Read about our Gender Pay Gap initiative and see how Ten10 perform","66","442","","0","Gender Pay Gap","14","Ten10's Headlines","17","","0","index, follow, max-image-preview:large, max-snippet:-1, max-video-preview:-1","","","https://ten10.com/company/corporate-and-social-responsibility/gender-pay-gap/","","","","","","106158","28546","28546","10.935","","920","128","7.188","54.892","Fairly Hard","6.343","2","3","","16","2","0","0.470","66","27","0","8","6","0","","","","","82a1e877dd72bb841542251b662ceec5","0.284","","","","","en-GB","1.1","","","","","","https://ten10.com/company/corporate-and-social-responsibility/gender-pay-gap/","2026-02-03 09:55:48"
"https://ten10.com/blog/the-growing-demand-for-ai-savvy-talent/","text/html; charset=UTF-8","200","OK","Indexable","","The growing demand for AI-savvy talent | Ten10","46","422","Read why the demand for AI-savvy tech talent is rising and what this means in an already competitive recruitment landscape.","123","792","","0","The growing demand for AI-savvy talent","38","The increasing complexity of AI skills","38","The competitive hiring landscape","32","index, follow, max-image-preview:large, max-snippet:-1, max-video-preview:-1","","","https://ten10.com/blog/the-growing-demand-for-ai-savvy-talent/","","","","","","122562","32260","32260","12.358","","1416","209","6.775","49.040","Hard","8.361","3","2","","21","6","0","1.410","79","35","0","10","8","0","","","","","425b15ca7061e31acb55b050d35280a4","0.027","","","","","en-GB","1.1","","","","","","https://ten10.com/blog/the-growing-demand-for-ai-savvy-talent/","2026-02-03 09:55:49"
"https://ten10.com/blog/five-essential-rpa-questions-for-your-organisation/","text/html; charset=UTF-8","301","Moved Permanently","Non-Indexable","Redirected","","0","0","","0","0","","0","","0","","0","","0","","","","","","","","","","0","0","0","0.000","","0","","","","","0.000","3","2","","1","1","0","0.230","0","0","0","0","0","0","","","","","","0.045","","https://ten10.com/blog/five-essential-agentic-automation-questions/","HTTP Redirect","","","1.1","","","","","","https://ten10.com/blog/five-essential-rpa-questions-for-your-organisation/","2026-02-03 09:55:49"
"https://ten10.com/case-studies/salesforce-ecommerce-migration-for-hobbycraft/","text/html; charset=UTF-8","200","OK","Indexable","","Salesforce eCommerce migration for Hobbycraft | Ten10","53","500","Read how we helped the UK's largest arts and crafts retailer migrate to a new eCommerce platform with a full suite of managed QA testing.","137","880","","0","Salesforce eCommerce migration for Hobbycraft","45","hobbycraft logo","15","The Project","11","index, follow, max-image-preview:large, max-snippet:-1, max-video-preview:-1","","","https://ten10.com/case-studies/salesforce-ecommerce-migration-for-hobbycraft/","","","","","","141595","37871","37871","14.508","","2773","361","7.681","59.187","Fairly Hard","13.307","2","2","","32","16","0","3.760","81","36","0","7","5","0","","","","","b3a1173cae3602ff78d93189f77595fc","0.306","","","","","en-GB","1.1","","","","","","https://ten10.com/case-studies/salesforce-ecommerce-migration-for-hobbycraft/","2026-02-03 09:55:49"
"https://ten10.com/case-studies/transition-of-testing-services-including-knowledge-transfer/","text/html; charset=UTF-8","200","OK","Indexable","","Transition of testing services including knowledge transfer | Ten10","67","587","Learn how we helped a global defence engineering company transform its regulatory audit and control processes through our managed service.","138","910","","0","Transition of testing services including knowledge transfer","59","How you can achieve the same results","36","Latest Insights","15","index, follow, max-image-preview:large, max-snippet:-1, max-video-preview:-1","","","https://ten10.com/case-studies/transition-of-testing-services-including-knowledge-transfer/","","","","","","126337","32734","32734","12.540","","1443","216","6.681","56.357","Fairly Hard","8.198","3","2","","22","7","0","1.640","81","36","0","7","5","0","","","","","ea744fa27c6158d92ef4c179cbafd7c3","0.309","","","","","en-GB","1.1","","","","","","https://ten10.com/case-studies/transition-of-testing-services-including-knowledge-transfer/","2026-02-03 09:55:49"
"https://ten10.com/blog/explained-the-four-web-accessibility-principles/","text/html; charset=UTF-8","200","OK","Indexable","","Explained: The four web accessibility principles | Ten10","56","486","Every web user should be able to use your site and services without issue – that means adhering to the POUR web accessibility principles.","137","870","","0","Explained: The four web accessibility principles","48","Every user that hears about you should be able to view your site and access your services without issue – that means adhering to the POUR web accessibility principles","166","Improve your customer experience with a Web Accessibility Audit","63","index, follow, max-image-preview:large, max-snippet:-1, max-video-preview:-1","","","https://ten10.com/blog/explained-the-four-web-accessibility-principles/","","","","","","129033","34504","34504","13.218","","2308","371","6.221","56.173","Fairly Hard","11.950","3","2","","22","6","0","1.410","81","36","0","9","7","0","","","","","c071ca8b0e935d53c65b215aea312f8d","0.015","","","","","en-GB","1.1","","","","","","https://ten10.com/blog/explained-the-four-web-accessibility-principles/","2026-02-03 09:55:50"
"https://ten10.com/blog/meet-our-academy-consultants-chris-olet/","text/html; charset=UTF-8","200","OK","Indexable","","Meet our Academy Consultants - Chris Olet | Ten10","49","450","Read about Chris’ experience at the Ten10 Academy and what skills he uses every day thanks to his training.","107","687","","0","Meet our Academy Consultants – Chris Olet","41","Read about Chris’ experience at the Ten10 Academy, his transition into client work in the Retail sector, and what skills he uses every day thanks to his training","161","Find talent like Chris and grow your tech team","46","index, follow, max-image-preview:large, max-snippet:-1, max-video-preview:-1","","","https://ten10.com/blog/meet-our-academy-consultants-chris-olet/","","","","","","124119","32724","32724","12.536","","1563","220","7.105","58.137","Fairly Hard","8.667","3","2","","21","6","0","1.410","80","35","0","7","5","0","","","","","e5361749f6aae3195fbb7e56b49e98e9","0.016","","","","","en-GB","1.1","","","","","","https://ten10.com/blog/meet-our-academy-consultants-chris-olet/","2026-02-03 09:55:50"
"https://ten10.com/blog/want-to-cross-the-tech-skills-gap-give-young-people-clarity-and-support/","text/html; charset=UTF-8","200","OK","Indexable","","Young tech talent needs clarity and support | Ten10","51","454","Learn about the state of the tech skills gap and how our Ten10 Academy can help to reduce the gap by kickstarting tech careers for talented people.","147","935","","0","Young tech talent needs clarity and support","43","Young people need clear information","35","Belief in young people isn’t matched by support","47","index, follow, max-image-preview:large, max-snippet:-1, max-video-preview:-1","","","https://ten10.com/blog/want-to-cross-the-tech-skills-gap-give-young-people-clarity-and-support/","","","","","","123761","32101","32101","12.297","","1282","185","6.930","57.460","Fairly Hard","7.303","3","2","","20","5","0","1.170","79","35","0","9","7","0","","","","","154cd53c04f2bc7a299be26ab9d4fd37","0.307","","","","","en-GB","1.1","","","","","","https://ten10.com/blog/want-to-cross-the-tech-skills-gap-give-young-people-clarity-and-support/","2026-02-03 09:55:50"
"https://ten10.com/insights/?_sft_category=case-studies&sf_paged=2","text/html; charset=UTF-8","200","OK","Non-Indexable","Canonicalised","Insights | Ten10","16","142","Read Ten10's expert insights, including blogs, webinars and whitepapers from our technical consultants across a wide range of industries.","137","870","","0","Insights","8","Learn more","10","Academy DevOps: Cloud-based device monitoring solution","54","index, follow, max-image-preview:large, max-snippet:-1, max-video-preview:-1","","","https://ten10.com/insights/","","","","","","128925","31983","31983","12.252","","802","174","4.609","41.923","Hard","4.878","3","1","","20","4","0","0.940","81","42","0","7","5","0","","","","","5200fe4db687b92d3401d0ff6b6d63c8","0.320","","","","","en-GB","1.1","","","","","","https://ten10.com/insights/?_sft_category=case-studies&sf_paged=2","2026-02-03 09:55:50"
"https://ten10.com/insights/?_sft_category=case-studies&sf_paged=3","text/html; charset=UTF-8","200","OK","Non-Indexable","Canonicalised","Insights | Ten10","16","142","Read Ten10's expert insights, including blogs, webinars and whitepapers from our technical consultants across a wide range of industries.","137","870","","0","Insights","8","Learn more","10","How the Ten10 Academy helped Tunstall Healthcare overcome their testing resourcing challenges","93","index, follow, max-image-preview:large, max-snippet:-1, max-video-preview:-1","","","https://ten10.com/insights/","","","","","","129659","32198","32198","12.334","","833","177","4.706","39.053","Hard","5.071","3","1","","20","4","0","0.940","81","42","0","7","5","0","","","","","19947ed6f8e8384a261b1112a46c73c0","0.326","","","","","en-GB","1.1","","","","","","https://ten10.com/insights/?_sft_category=case-studies&sf_paged=3","2026-02-03 09:55:50"
"https://ten10.com/blog/how-do-you-measure-quality-and-deliver-it/","text/html; charset=UTF-8","200","OK","Indexable","","How do you measure 'quality' and how do you deliver it? | Ten10","63","561","How can software quality be measured and delivered effectively? Find out from our expert Quality Engineering consultants.","121","778","","0","How do you measure ‘quality’ and how do you deliver it?","55","What is ‘quality’?","18","People also ask","15","index, follow, max-image-preview:large, max-snippet:-1, max-video-preview:-1","","","https://ten10.com/blog/how-do-you-measure-quality-and-deliver-it/","","","","","","124240","32575","32575","12.479","","1469","228","6.443","49.467","Hard","8.359","3","2","","25","9","0","2.110","84","40","0","10","8","0","","","","","cd17fb018280979ef3b3becae174e1bd","0.043","","","","","en-GB","1.1","","","","","","https://ten10.com/blog/how-do-you-measure-quality-and-deliver-it/","2026-02-03 09:55:50"
"https://ten10.com/blog/the-future-of-rpa/","text/html; charset=UTF-8","200","OK","Indexable","","The future of RPA: on its way out or up? | Ten10","48","419","As part of the Intelligent Automation (IA) umbrella, does standalone RPA still meet expectations? Let’s delve into the future of RPA.","133","828","","0","The future of RPA: on its way out or up?","40","""Advancements in large language models (LLMs) and generative AI will streamline the development of automations and address complex, previously hard-to-automate processes.""","171","""Platforms are increasingly emphasising seamless integrations to enhance user experience. By integrating RPA with Machine Learning (ML) and AI, we achieve not just task automation, but comprehensive end-to-end process management without human intervention.""","257","index, follow, max-image-preview:large, max-snippet:-1, max-video-preview:-1","","","https://ten10.com/blog/the-future-of-rpa/","","","","","","126617","32671","32671","12.516","","1341","217","6.180","49.658","Hard","7.661","3","2","","20","5","0","1.170","81","35","0","9","7","0","","","","","810e7acb304f657034fa4b765e758f3a","0.379","","","","","en-GB","1.1","","","","","","https://ten10.com/blog/the-future-of-rpa/","2026-02-03 09:55:50"
"https://ten10.com/blog/shift-happens-tech-career-change-francisco-anthony/","text/html; charset=UTF-8","200","OK","Indexable","","Shift happens: changing careers through the Ten10 Academy | Ten10","65","611","Hear Francisco and Anthony's experiences of kickstarting completely new careers in tech by joining the Ten10 Academy.","117","763","","0","Shift happens: changing careers through the Ten10 Academy","57","Hear Francisco and Anthony’s experiences of kickstarting completely new careers in tech by joining the Ten10 Academy","116","Reinvent your tech team recruitment and bring new talent into your team","71","index, follow, max-image-preview:large, max-snippet:-1, max-video-preview:-1","","","https://ten10.com/blog/shift-happens-tech-career-change-francisco-anthony/","","","","","","128869","34351","34351","13.159","","2132","293","7.276","69.772","Normal","10.464","3","2","","21","6","0","1.410","80","35","0","7","5","0","","","","","716bc115b0c586d36be7576478924561","0.029","","","","","en-GB","1.1","","","","","","https://ten10.com/blog/shift-happens-tech-career-change-francisco-anthony/","2026-02-03 09:55:51"
"https://ten10.com/blog/how-to-improve-code-quality/","text/html; charset=UTF-8","200","OK","Indexable","","How to improve code quality | Ten10","35","322","Learn how to improve your organisation's code quality, and build a culture of coding excellence that will pay dividends long into the future.","141","867","","0","How to improve code quality","27","Build a culture of coding excellence that will pay dividends long into the future","81","People also ask","15","index, follow, max-image-preview:large, max-snippet:-1, max-video-preview:-1","","","https://ten10.com/blog/how-to-improve-code-quality/","","","","","","130999","35713","35713","13.681","","2217","332","6.678","48.868","Hard","11.761","3","2","","27","12","0","2.820","83","39","0","13","11","0","","","","","52c7c9dcb9591fed036a7c3aae4d2ec5","0.027","","","","","en-GB","1.1","","","","","","https://ten10.com/blog/how-to-improve-code-quality/","2026-02-03 09:55:51"
"https://ten10.com/category/blog/page/2/","text/html; charset=UTF-8","200","OK","Indexable","","Blog Archives | Page 2 of 20 | Ten10","36","318","Get expert insights from a consultancy team with decades of experience, including e-guides, webinars, whitepapers and case studies of Ten10's previous work.","156","1006","","0","Blog","4","Posts pagination","16","","0","index, follow, max-image-preview:large, max-snippet:-1, max-video-preview:-1","","","https://ten10.com/category/blog/page/2/","https://ten10.com/category/blog/page/3/","https://ten10.com/category/blog/","","","","120237","28257","28257","10.825","","630","113","5.575","52.522","Fairly Hard","4.176","3","4","","19","3","0","0.700","100","40","0","7","5","0","","","","","14e42cbf58fe6699368e18fab82e86c2","0.309","","","","","en-GB","1.1","","","","","","https://ten10.com/category/blog/page/2/","2026-02-03 09:55:51"
"https://ten10.com/blog/shift-happens-from-business-owner-to-tech-consultant/","text/html; charset=UTF-8","200","OK","Indexable","","Shift happens: From business owner to tech consultant | Ten10","61","558","Read how Anh used transferable skills to start a new career in tech, and what advice she has for fellow career changers.","120","758","","0","Shift happens: From business owner to tech consultant","53","Read how Anh used transferable skills from her time running her own business to start a new career in tech, and what advice she has for fellow career changers","158","Reinvent your recruitment strategy and bring new talent into your team","70","index, follow, max-image-preview:large, max-snippet:-1, max-video-preview:-1","","","https://ten10.com/blog/shift-happens-from-business-owner-to-tech-consultant/","","","","","","122607","32272","32272","12.363","","1442","203","7.103","62.693","Normal","8.005","3","2","","21","6","0","1.410","79","35","0","7","5","0","","","","","62f6104beaddbfe2f6bca0df6d970a86","0.022","","","","","en-GB","1.1","","","","","","https://ten10.com/blog/shift-happens-from-business-owner-to-tech-consultant/","2026-02-03 09:55:51"
"https://ten10.com/blog/essential-questions-to-evaluate-your-test-automation-strategy/","text/html; charset=UTF-8","200","OK","Indexable","","Test automation strategy essential questions | Ten10","52","470","Take the first step towards effective test automation implementation with our essential strategy questions.","107","679","","0","Essential questions to evaluate your test automation strategy","61","Does your organisation have a strategy ready to make the most of test automation?","81","People also ask","15","index, follow, max-image-preview:large, max-snippet:-1, max-video-preview:-1","","","https://ten10.com/blog/essential-questions-to-evaluate-your-test-automation-strategy/","","","","","","123470","32196","32196","12.334","","1405","211","6.659","55.684","Fairly Hard","7.981","3","2","","22","7","0","1.640","84","39","0","7","5","0","","","","","e01ce578dfa6b3707c807843e5a3442e","0.014","","","","","en-GB","1.1","","","","","","https://ten10.com/blog/essential-questions-to-evaluate-your-test-automation-strategy/","2026-02-03 09:55:51"
