"Address","Content Type","Status Code","Status","Indexability","Indexability Status","Title 1","Title 1 Length","Title 1 Pixel Width","Meta Description 1","Meta Description 1 Length","Meta Description 1 Pixel Width","Meta Keywords 1","Meta Keywords 1 Length","H1-1","H1-1 Length","H2-1","H2-1 Length","H2-2","H2-2 Length","Meta Robots 1","X-Robots-Tag 1","Meta Refresh 1","Canonical Link Element 1","rel=""next"" 1","rel=""prev"" 1","HTTP rel=""next"" 1","HTTP rel=""prev"" 1","amphtml Link Element","Size (bytes)","Transferred (bytes)","Total Transferred (bytes)","CO2 (mg)","Carbon Rating","Word Count","Sentence Count","Average Words Per Sentence","Flesch Reading Ease Score","Readability","Text Ratio","Crawl Depth","Folder Depth","Link Score","Inlinks","Unique Inlinks","Unique JS Inlinks","% of Total","Outlinks","Unique Outlinks","Unique JS Outlinks","External Outlinks","Unique External Outlinks","Unique External JS Outlinks","Closest Near Duplicate Match","No. Near Duplicates","Spelling Errors","Grammar Errors","Hash","Response Time","Last Modified","Redirect URL","Redirect Type","Cookies","Language","HTTP Version","Mobile Alternate Link","Closest Semantically Similar Address","Semantic Similarity Score","No. Semantically Similar","Semantic Relevance Score","URL Encoded Address","Crawl Timestamp"
"https://ten10.com/","text/html; charset=UTF-8","200","OK","Indexable","","AI-Native Agentic Automation & Quality Engineering Services | Ten10","67","604","Secure enterprise agentic automation from Ten10 to support mission-critical processes with quality engineering expertise.","121","774","","0","Addressing your productivity challenges with our quality-first, AI-native approach to digital transformation","108","Without data there is no AI. Without the cloud there is no data. And without a quality-first approach, there is no confidence","125","Agentic Automation is a game changer for efficiency, agility, speed and growth","78","index, follow, max-image-preview:large, max-snippet:-1, max-video-preview:-1","","","https://ten10.com/","","","","","","150049","35279","35279","13.515","","1040","163","6.380","39.700","Hard","5.298","0","0","","871","426","0","100.000","89","31","0","7","5","0","","","","","46fca183b5e15b6a7d8ee84e21f18111","0.036","","","","","en-GB","1.1","","","","","","https://ten10.com/","2026-02-03 09:55:25"
"https://ten10.com/company/corporate-and-social-responsibility/accessibility/","text/html; charset=UTF-8","200","OK","Indexable","","Accessibility | Ten10","21","182","Being experts in website accessibility, we naturally take our own very seriously. Click here to read Ten10's Accessibility Statement.","133","825","","0","Accessibility Statement","23","How accessible this website is","30","Feedback and contact information","32","index, follow, max-image-preview:large, max-snippet:-1, max-video-preview:-1","","","https://ten10.com/company/corporate-and-social-responsibility/accessibility/","","","","","","101319","27050","27050","10.362","","836","121","6.909","56.528","Fairly Hard","6.060","1","3","","441","426","0","100.000","68","26","0","7","5","0","","","","","e5a321b2f2aa4a17b937e110a4594bcb","0.039","","","","","en-GB","1.1","","","","","","https://ten10.com/company/corporate-and-social-responsibility/accessibility/","2026-02-03 09:55:27"
"https://ten10.com/legal-notice/","text/html; charset=UTF-8","200","OK","Indexable","","Legal Notice | Ten10","20","181","Read Ten10's legal notice of terms and conditions, including who we are, how to contact us, and how we use information on our site.","131","834","","0","Legal Notice","12","1. Who We Are And How To Contact Ten10","38","2. Purpose Of The Site","22","index, follow, max-image-preview:large, max-snippet:-1, max-video-preview:-1","","","https://ten10.com/legal-notice/","","","","","","106052","29382","29382","11.256","","1783","271","6.579","66.685","Normal","10.872","1","1","","442","426","0","100.000","68","26","0","7","5","0","","","","","ec893c740ef17551e3c12988e5f7faf4","0.064","","","","","en-GB","1.1","","","","","","https://ten10.com/legal-notice/","2026-02-03 09:55:27"
"https://ten10.com/contact/","text/html; charset=UTF-8","200","OK","Indexable","","Contact | Ten10","15","140","Whether you want to learn how our consultants can help your organisation or you want to start a new career in tech, contact our team today.","139","886","","0","Contact","7","Get in touch","12","Or interested in joining the Ten10 Academy?","43","index, follow, max-image-preview:large, max-snippet:-1, max-video-preview:-1","","","https://ten10.com/contact/","","","","","","130106","34455","34455","13.199","","637","119","5.353","58.365","Fairly Hard","3.814","1","1","","577","426","0","100.000","65","27","0","7","5","0","","","","","ffc0a858bbf7308b03b6a3b637cbc142","0.363","","","","","en-GB","1.1","","","","","","https://ten10.com/contact/","2026-02-03 09:55:27"
"https://ten10.com/privacy-policy/","text/html; charset=UTF-8","200","OK","Indexable","","Privacy Policy | Ten10","22","194","Read Ten10's privacy policy, including our security and data retention measures, and contact information for complaints.","120","760","","0","Privacy Policy","14","1. Personal Information that we collect from you","48","2. Personal Information that we receive from other sources","58","index, follow, max-image-preview:large, max-snippet:-1, max-video-preview:-1","","","https://ten10.com/privacy-policy/","","","","","","113638","31936","31936","12.234","","2825","375","7.533","60.025","Normal","16.134","1","1","","443","426","0","100.000","65","26","0","11","9","0","","","","","7ded474f186f649d5700f1b31f0e5191","0.153","","","","","en-GB","1.1","","","","","","https://ten10.com/privacy-policy/","2026-02-03 09:55:27"
"https://ten10.com/consultancy/cloud-devops/","text/html; charset=UTF-8","200","OK","Indexable","","Cloud & DevOps Services: Migration Services | Ten10","51","465","Maximise your business productivity with our Cloud & DevOps Services. DevOps migrations, infrastructure management, disaster recovery & cost optimisation.","154","1003","","0","Cloud & DevOps","14","DevOps, FinOps, Cloud, Artificial Intelligence (AI), Agile","58","Cloud & DevOps are driving new ways of working, saving money and the use of AI is helping to accelerate value realisation.","122","index, follow, max-image-preview:large, max-snippet:-1, max-video-preview:-1","","","https://ten10.com/consultancy/cloud-devops/","","","","","","221636","50557","50557","19.367","","3369","481","7.004","46.471","Hard","10.533","1","2","","913","426","0","100.000","72","29","0","9","7","0","","","","","b9c2150f595a00c07be1bb99c97d8a20","0.477","","","","","en-GB","1.1","","","","","","https://ten10.com/consultancy/cloud-devops/","2026-02-03 09:55:27"
"https://ten10.com/tech-academy/academy-tour/","text/html; charset=UTF-8","200","OK","Indexable","","Academy Tour | Ten10","20","199","Book a tour of the Ten10 Academy and discover how we create your future tech talent across a range of testing and development disciplines.","138","893","","0","Academy Tour","12","Discover how we create your future talent","41","Start finding solutions","23","index, follow, max-image-preview:large, max-snippet:-1, max-video-preview:-1","","","https://ten10.com/tech-academy/academy-tour/","","","","","","138222","35995","35995","13.789","","706","112","6.304","53.166","Fairly Hard","3.915","1","2","","919","426","0","100.000","73","29","0","7","5","0","","","","","fa7808f677c458d8b670862f26215d8c","0.425","","","","","en-GB","1.1","","","","","","https://ten10.com/tech-academy/academy-tour/","2026-02-03 09:55:27"
"https://ten10.com/test-automation-consultancy-services/","text/html; charset=UTF-8","200","OK","Indexable","","Test Automation Services | Automation Consultancy | Ten10","57","531","Ten10's industry-leading test automation services deliver efficient solutions and frameworks from Mobile, Agile and Unit to UI and Service Layer testing.","153","960","","0","Efficient Quality Assurance with Test Automation Services & Consultancy","71","Work with an industry-leading test automation provider with Ten10’s Test Automation Advisory and Test Factory","109","Enhance your business with effective Test and QA Automation Services","68","index, follow, max-image-preview:large, max-snippet:-1, max-video-preview:-1","","","https://ten10.com/test-automation-consultancy-services/","","","","","","197608","47742","47742","18.289","","2586","380","6.805","39.430","Hard","9.409","1","1","","87","55","0","12.910","82","34","0","7","5","0","","","","","215ba554f784d939b7b329eca7e4d550","0.484","","","","","en-GB","1.1","","","","","","https://ten10.com/test-automation-consultancy-services/","2026-02-03 09:55:27"
"https://ten10.com/consultancy/software-testing-quality-assurance-services/","text/html; charset=UTF-8","200","OK","Indexable","","Software Testing & Quality Assurance Services | Ten10","53","484","Quality Assurance (QA) and software testing servicesthat lead the industry, helping UK clients strategically balance quality with risk to gaina competitive market advantage.","173","1084","","0","Software Testing and Quality Assurance Consultancy","50","Addressing business concerns with software and QA testing services","66","Explore Ten10's QA & Software Testing services","46","index, follow, max-image-preview:large, max-snippet:-1, max-video-preview:-1","","","https://ten10.com/consultancy/software-testing-quality-assurance-services/","","","","","","158958","37700","37700","14.442","","2102","311","6.759","44.056","Hard","9.567","1","2","","900","426","0","100.000","92","36","0","7","5","0","","","","","1b5a262f7b787596396c37b1d887df16","0.023","","","","","en-GB","1.1","","","","","","https://ten10.com/consultancy/software-testing-quality-assurance-services/","2026-02-03 09:55:28"
"https://ten10.com/company/technologies/","text/html; charset=UTF-8","200","OK","Indexable","","Technologies | Ten10","20","190","Ten10 provides Quality Engineering, Automation and Academy Engineer expertise. See the wide range of tools and technologies we use with our clients.","148","962","","0","Technologies","12","Ten10 provides Quality Engineering, Automation and Academy Engineer expertise covering a wide range of tools and technologies","125","Get in touch","12","index, follow, max-image-preview:large, max-snippet:-1, max-video-preview:-1","","","https://ten10.com/company/technologies/","","","","","","184462","33606","33606","12.874","","578","99","5.838","46.492","Hard","2.555","1","2","","870","426","0","100.000","66","26","0","7","5","0","","","","","847370f8a187d4ebb5b76e97af52befc","0.016","","","","","en-GB","1.1","","","","","","https://ten10.com/company/technologies/","2026-02-03 09:55:28"
"https://ten10.com/tech-academy/","text/html; charset=UTF-8","200","OK","Indexable","","Tech Academy | Ten10","20","202","Bridge the tech skills gap in your business with Ten10's recruit, train, deploy Tech Academy. Find trained technologists to work across software development, cloud systems, RPA","176","1121","","0","Tech Academy","12","AI/machine learning skills","26","See how we provide businesses with the technologists they need to stay ahead of their competition","97","index, follow, max-image-preview:large, max-snippet:-1, max-video-preview:-1","","","https://ten10.com/tech-academy/","","","","","","179394","40963","40963","15.692","","2536","370","6.854","48.192","Hard","9.946","1","1","","1803","426","0","100.000","78","31","0","8","6","0","","","","","d1c120cb669602ff8642620e9fece799","0.044","","","","","en-GB","1.1","","","","","","https://ten10.com/tech-academy/","2026-02-03 09:55:28"
"https://ten10.com/blog/building-automation-culture-through-human-ai-collaboration/","text/html; charset=UTF-8","200","OK","Indexable","","Building a culture of automation through Human + AI collaboration | Ten10","73","658","Learn how organisations can create a collaborative environment where the strengths of humans and AI pave the way for continuous innovation.","139","910","","0","Building a sustainable automation culture through Human + AI collaboration","74","Creating a culture where automation thrives","43","The power of Human + AI collaboration","37","index, follow, max-image-preview:large, max-snippet:-1, max-video-preview:-1","","","https://ten10.com/blog/building-automation-culture-through-human-ai-collaboration/","","","","","","126593","33471","33471","12.822","","1710","270","6.333","48.671","Hard","9.615","1","2","","21","6","0","1.410","80","35","0","7","5","0","","","","","7622fc36fab6079f1fd615cdc7b892c","0.157","","","","","en-GB","1.1","","","","","","https://ten10.com/blog/building-automation-culture-through-human-ai-collaboration/","2026-02-03 09:55:29"
"https://ten10.com/consultancy/quality-engineering/","text/html; charset=UTF-8","200","OK","Indexable","","Quality Engineering Consultancy & Services | Ten10","50","453","Ten10 deliver Quality Engineering advisory services including software testing, consultancy and leadership in continuous delivery and DevOps.","141","897","","0","Quality Engineering Consultancy & Services","42","Explore Ten10's Quality Engineering Services","44","What is Quality Engineering and how can it transform your organisation?","71","index, follow, max-image-preview:large, max-snippet:-1, max-video-preview:-1","","","https://ten10.com/consultancy/quality-engineering/","","","","","","151931","39370","39370","15.082","","1665","250","6.660","41.291","Hard","8.031","1","2","","921","426","0","100.000","83","39","0","7","5","0","","","","","f98970690b5619b05f2f72428c89ed84","0.412","","","","","en-GB","1.1","","","","","","https://ten10.com/consultancy/quality-engineering/","2026-02-03 09:55:28"
"https://ten10.com/consultancy/robotic-process-automation-services/","text/html; charset=UTF-8","200","OK","Indexable","","Robotic Process Automation (RPA) Consultancy Services | Ten10","61","574","Reap the benefits of quality Robotic Process Automation (RPA) implementation and expert RPA knowledge to streamline projects that add value to your organisation","160","1041","","0","Robotic Process Automation (RPA) Consultancy Services","53","Our expert RPA Consultants can help you deliver effective projects that add value to your organisation today","108","Benefits of using Robotic Process Automation (RPA)","50","index, follow, max-image-preview:large, max-snippet:-1, max-video-preview:-1","","","https://ten10.com/consultancy/robotic-process-automation-services/","","","","","","199519","47315","47315","18.125","","2135","385","5.545","36.920","Hard","7.866","1","2","","927","426","0","100.000","86","40","0","7","5","0","","","","","dce7f93a67b43db60c05ce7358f829a","0.452","","","","","en-GB","1.1","","","","","","https://ten10.com/consultancy/robotic-process-automation-services/","2026-02-03 09:55:28"
"https://ten10.com/cookie-policy/","text/html; charset=UTF-8","200","OK","Indexable","","Cookie Policy | Ten10","21","190","Want to know how we use cookies? Read our Cookie Policy to learn what types we use and how you can control your cookie preferences.","131","865","","0","Cookie Policy","13","1. Introduction","15","2. What are cookies?","20","index, follow, max-image-preview:large, max-snippet:-1, max-video-preview:-1","","","https://ten10.com/cookie-policy/","","","","","","140531","32354","32354","12.394","","2217","732","3.029","52.610","Fairly Hard","11.541","1","1","","442","426","0","100.000","66","26","0","43","37","0","","","","","d4058397a18e70ce925eb2aa8b2b71bc","0.069","","","","","en-GB","1.1","","","","","","https://ten10.com/cookie-policy/","2026-02-03 09:55:29"
"https://ten10.com/company/","text/html; charset=UTF-8","200","OK","Indexable","","Company | Ten10","15","155","Ten10 is a leading provider of Tech Talent, Quality Engineering and Automation consulting services to help businesses deliver tangible results.","143","897","","0","Company","7","Leading the way in Cloud, Data, Quality Engineering AI, Automation solutions and Next-Gen Tech Talent","101","","0","index, follow, max-image-preview:large, max-snippet:-1, max-video-preview:-1","","","https://ten10.com/company/","","","","","","113308","28879","28879","11.063","","921","136","6.772","49.225","Hard","6.124","1","1","","876","426","0","100.000","72","27","0","7","5","0","","","","","1dacac17393b7deee7209f26799a30d0","0.358","","","","","en-GB","1.1","","","","","","https://ten10.com/company/","2026-02-03 09:55:29"
"https://ten10.com/insights/","text/html; charset=UTF-8","200","OK","Indexable","","Insights | Ten10","16","142","Read Ten10's expert insights, including blogs, webinars and whitepapers from our technical consultants across a wide range of industries.","137","870","","0","Insights","8","Learn more","10","What is cognitive automation and when should you use it?","56","index, follow, max-image-preview:large, max-snippet:-1, max-video-preview:-1","","","https://ten10.com/insights/","","","","","","128562","31877","31877","12.211","","799","177","4.514","41.312","Hard","4.894","1","1","","1197","426","0","100.000","80","41","0","7","5","0","","","","","35a747a1edba245d8487ca72bd9484e2","0.039","","","","","en-GB","1.1","","","","","","https://ten10.com/insights/","2026-02-03 09:55:29"
"https://ten10.com/consultancy/","text/html; charset=UTF-8","200","OK","Indexable","","Consultancy Services: Quality Engineering & Automation | Ten10","62","566","Ten10’s Consultancy team delivers industry leading Quality Engineering, Automation,Cloud & DevOps and Business Analysis solutions and services.","143","932","","0","Consultancy","11","Quality Engineering","19","AI and Automation","17","index, follow, max-image-preview:large, max-snippet:-1, max-video-preview:-1","","","https://ten10.com/consultancy/","","","","","","124404","30969","30969","11.864","","1137","171","6.649","34.904","Hard","7.019","1","1","","884","426","0","100.000","74","28","0","7","5","0","","","","","fe0705de35ad579198aba29112069b06","0.048","","","","","en-GB","1.1","","","","","","https://ten10.com/consultancy/","2026-02-03 09:55:30"
"https://ten10.com/consultancy/software-testing-quality-assurance-services/data-testing/","text/html; charset=UTF-8","200","OK","Indexable","","Data Testing Services | Ten10","29","262","Dependable data testing has never been so important. Learn how our expert consultants can create a bespoke solution to maximise your return on investment.","154","1006","","0","Data Testing Services","21","Data analysis and reporting, big data testing and data migration services","73","How adopting an Agile approach reduced regression testing time by 70%","69","index, follow, max-image-preview:large, max-snippet:-1, max-video-preview:-1","","","https://ten10.com/consultancy/software-testing-quality-assurance-services/data-testing/","","","","","","128927","35881","35881","13.745","","1259","179","7.034","43.599","Hard","7.259","1","3","","17","3","0","0.700","70","30","0","7","5","0","","","","","38669404232f81626bf679b2a68401a2","0.359","","","","","en-GB","1.1","","","","","","https://ten10.com/consultancy/software-testing-quality-assurance-services/data-testing/","2026-02-03 09:55:29"
"https://ten10.com/tenology/","text/html; charset=UTF-8","200","OK","Indexable","","Tenology® | Ten10","17","168","Find out about Tenology®, Ten10's methodology for consistently delivering our industry-leading services and solutions for our clients.","134","841","","0","Tenology®","9","Tenology®","9","Tenology®: Ten10's Delivery Methodology","39","index, follow, max-image-preview:large, max-snippet:-1, max-video-preview:-1","","","https://ten10.com/tenology/","","","","","","107986","28632","28632","10.968","","783","130","6.023","44.379","Hard","5.641","1","1","","893","426","0","100.000","73","29","0","7","5","0","","","","","ab527e594797000b7b9e1806aa3dbd13","0.330","","","","","en-GB","1.1","","","","","","https://ten10.com/tenology/","2026-02-03 09:55:29"
"https://ten10.com/company/corporate-and-social-responsibility/environmental-social-and-corporate-governance/","text/html; charset=UTF-8","200","OK","Indexable","","Environmental, Social and Corporate Governance | Ten10","54","502","Ten10 has always been committed to changing the tech industry for the better. Read about our commitment to environmental, social and corporate governance.","154","1015","","0","Environmental, Social and Corporate Governance","46","","0","","0","index, follow, max-image-preview:large, max-snippet:-1, max-video-preview:-1","","","https://ten10.com/company/corporate-and-social-responsibility/environmental-social-and-corporate-governance/","","","","","","111539","29042","29042","11.125","","840","124","6.774","45.564","Hard","5.763","1","3","","868","426","0","100.000","69","29","0","7","5","0","","","","","bf4af6bfca989c8ae1a5e122340d2a1a","0.013","","","","","en-GB","1.1","","","","","","https://ten10.com/company/corporate-and-social-responsibility/environmental-social-and-corporate-governance/","2026-02-03 09:55:30"
"https://ten10.com/company/corporate-and-social-responsibility/","text/html; charset=UTF-8","200","OK","Indexable","","Corporate & Social Responsibility | Ten10","41","362","We remain committed to treating everyone the same, regardless of their background. Click to read our Corporate and Social Responsibility statement.","147","946","","0","Corporate & Social Responsibility","33","Equality","8","Fundraising at Ten10","20","index, follow, max-image-preview:large, max-snippet:-1, max-video-preview:-1","","","https://ten10.com/company/corporate-and-social-responsibility/","","","","","","109804","28612","28612","10.961","","851","131","6.496","51.023","Fairly Hard","5.837","1","2","","890","426","0","100.000","66","26","0","8","6","0","","","","","f4e610088164151bb02b219f20ae82e0","0.016","","","","","en-GB","1.1","","","","","","https://ten10.com/company/corporate-and-social-responsibility/","2026-02-03 09:55:30"
"https://ten10.com/company/press/","text/html; charset=UTF-8","200","OK","Indexable","","Press | Ten10","13","121","See where Ten10's expert Consultants and Senior Leadership Team have been featured in online press, sharing their expert IT insights.","133","856","","0","Ten10 in the Press","18","See where Ten10's expert Consultants and Senior Leadership Team have been featured in online press","98","Get in touch","12","index, follow, max-image-preview:large, max-snippet:-1, max-video-preview:-1","","","https://ten10.com/company/press/","","","","","","211824","41828","41828","16.024","","1314","245","5.363","64.383","Normal","4.293","1","2","","868","426","0","100.000","66","26","0","63","59","0","","","","","785821c963f276980b98951c810cb557","0.023","","","","","en-GB","1.1","","","","","","https://ten10.com/company/press/","2026-02-03 09:55:30"
"https://ten10.com/ai/","text/html; charset=UTF-8","200","OK","Indexable","","Artificial Intelligence (AI) Solutions | Ten10","46","376","Need help to accelerate your AI journey? Learn how we implement AI solutions into our software testing, DevOps, and RPA services.","129","834","","0","Artificial Intelligence, Intelligently Delivered","48","An intelligent approach to AI implementation that goes beyond the hype","70","says 85% of Artificial Intelligence (AI) and Machine Learning (ML) projects fail to produce a return for the business (Forbes 2023)","131","index, follow, max-image-preview:large, max-snippet:-1, max-video-preview:-1","","","https://ten10.com/ai/","","","","","","145245","35741","35741","13.692","","1829","255","7.173","45.480","Hard","8.905","1","1","","896","426","0","100.000","82","33","0","7","5","0","","","","","b3dbc9e8be975e2d16bf181d350e171a","0.355","","","","","en-GB","1.1","","","","","","https://ten10.com/ai/","2026-02-03 09:55:30"
"https://ten10.com/consultancy/automation-services/","text/html; charset=UTF-8","200","OK","Indexable","","Automation Consultancy Services | Ten10","39","369","Our automation consultancy services are delivered by experienced Automation Consultants ensuring you can deliver your business outcomes.","136","898","","0","Automation Services","19","Discover the Power of Automation","32","Tailored Automation Solutions for your Business","47","index, follow, max-image-preview:large, max-snippet:-1, max-video-preview:-1","","","https://ten10.com/consultancy/automation-services/","","","","","","122853","30523","30523","11.693","","972","146","6.658","44.455","Hard","6.063","1","2","","888","426","0","100.000","77","30","0","7","5","0","","","","","268704bb9ff442966fd33376ed264269","0.019","","","","","en-GB","1.1","","","","","","https://ten10.com/consultancy/automation-services/","2026-02-03 09:55:30"
"https://ten10.com/consultancy/business-analysis/","text/html; charset=UTF-8","200","OK","Indexable","","Business Analysis | Ten10","25","232","Learn how our expert Business Analysts use requirement definition and business process design to support clients just like you.","127","806","","0","Business Analysis","17","Empowering change and driving success with expert Business Analysis","67","Tackle common challenges with Business Analysis from Ten10","58","index, follow, max-image-preview:large, max-snippet:-1, max-video-preview:-1","","","https://ten10.com/consultancy/business-analysis/","","","","","","142143","34879","34879","13.361","","1433","224","6.397","38.698","Hard","7.583","1","2","","881","426","0","100.000","76","29","0","7","5","0","","","","","9b73a0c909050af7b718ab4a56f43674","0.053","","","","","en-GB","1.1","","","","","","https://ten10.com/consultancy/business-analysis/","2026-02-03 09:55:31"
