"https://ten10.com/blog/how-do-you-expand-your-devops-team-now-and-in-the-future/","text/html; charset=UTF-8","200","OK","Indexable","","How do you expand your DevOps team, now and in the future | Ten10","65","607","Read about the different strategies you can use to extend your DevOps team, and learn how our Ten10 Academy can help your organisation grow.","140","922","","0","How do you expand your DevOps team, now and in the future","57","A Different Approach","20","Delivering Success","18","index, follow, max-image-preview:large, max-snippet:-1, max-video-preview:-1","","","https://ten10.com/blog/how-do-you-expand-your-devops-team-now-and-in-the-future/","","","","","","123192","32239","32239","12.350","","1489","200","7.445","63.316","Normal","8.155","3","2","","20","5","0","1.170","83","36","0","7","5","0","","","","","a2910c9d52267471335ed79ffa275a4f","0.018","","","","","en-GB","1.1","","","","","","https://ten10.com/blog/how-do-you-expand-your-devops-team-now-and-in-the-future/","2026-02-03 09:56:01"
"https://ten10.com/blog/benefits-and-examples-of-accessible-web-design/","text/html; charset=UTF-8","200","OK","Indexable","","Benefits and examples of accessible web design | Ten10","54","501","Learn why web accessibility should be a priority for your business and see which websites are getting it right.","111","687","","0","Benefits and examples of accessible web design","46","Learn why web accessibility should be a priority for your business and see which websites are getting it right with Ten10 Principal Consultant, Charlotte Hayes","159","Benefits of accessible web design","33","index, follow, max-image-preview:large, max-snippet:-1, max-video-preview:-1","","","https://ten10.com/blog/benefits-and-examples-of-accessible-web-design/","","","","","","135615","36362","36362","13.930","","2337","326","7.169","60.622","Normal","11.213","3","2","","21","6","0","1.410","79","36","0","22","20","0","","","","","13c9aabc719100ccc54a3d3f139b4af1","0.015","","","","","en-GB","1.1","","","","","","https://ten10.com/blog/benefits-and-examples-of-accessible-web-design/","2026-02-03 09:56:01"
"https://ten10.com/blog/generalists-the-hidden-asset-youre-overlooking/","text/html; charset=UTF-8","200","OK","Indexable","","Generalists: The hidden asset you're overlooking | Ten10","56","496","Our Transformation Director explains how hiring more generalists could be the solution to the tech skills shortage holding back your business.","142","892","","0","Generalists: The hidden asset you’re overlooking","48","Learn how hiring more generalists could be the solution to the tech skills shortage holding back your business","110","Read how we're training our consultants to use AI","49","index, follow, max-image-preview:large, max-snippet:-1, max-video-preview:-1","","","https://ten10.com/blog/generalists-the-hidden-asset-youre-overlooking/","","","","","","123045","32146","32146","12.315","","1385","216","6.412","52.628","Fairly Hard","7.954","3","2","","20","5","0","1.170","79","36","0","7","5","0","","","","","33e3ab767298be1839a46a341ce3460e","0.014","","","","","en-GB","1.1","","","","","","https://ten10.com/blog/generalists-the-hidden-asset-youre-overlooking/","2026-02-03 09:56:01"
"https://ten10.com/blog/how-ai-is-changing-the-role-of-software-testers/","text/html; charset=UTF-8","200","OK","Indexable","","How AI is changing the role of software testers | Ten10","55","484","Read how the increasing adoption of AI affects quality professionals, bringing new responsibilities and challenges to their role.","129","795","","0","How AI is changing the role of software testers","47","Ten10 Managing Principal Consultant Stuart Day considers how the role of modern software testers is evolving because of the widespread implementation of AI","155","Final thoughts","14","index, follow, max-image-preview:large, max-snippet:-1, max-video-preview:-1","","","https://ten10.com/blog/how-ai-is-changing-the-role-of-software-testers/","","","","","","128360","33820","33820","12.956","","1848","256","7.219","51.778","Fairly Hard","9.960","3","2","","21","6","0","1.410","81","36","0","7","5","0","","","","","cb75ef3add1fa70fda41b4e7dd229ca2","0.306","","","","","en-GB","1.1","","","","","","https://ten10.com/blog/how-ai-is-changing-the-role-of-software-testers/","2026-02-03 09:56:01"
"https://ten10.com/devops-pipeline-engineering-solutions-consulting-services/","text/html; charset=UTF-8","200","OK","Indexable","","DevOps Pipeline Engineering Solutions and Services | Ten10","58","528","Ten10’s Pipeline Engineering Solutions and Services provide short, medium and long term support as you adopt DevOps tools, technology and working practices.","156","1014","","0","DevOps Pipeline Engineering Solutions and Services","50","Accelerate Your Transformation to DevOps with Ten10","51","DevOps Consulting Services","26","index, follow, max-image-preview:large, max-snippet:-1, max-video-preview:-1","","","https://ten10.com/devops-pipeline-engineering-solutions-consulting-services/","","","","","","121937","31951","31951","12.240","","1501","212","7.080","43.074","Hard","9.092","3","1","","20","6","0","1.410","70","29","0","7","5","0","","","","","8b7051788f391abe0d704fb3a9204338","0.015","","","","","en-GB","1.1","","","","","","https://ten10.com/devops-pipeline-engineering-solutions-consulting-services/","2026-02-03 09:56:01"
"https://ten10.com/blog/the-transformer-trap-why-your-ai-strategy-needs-an-exit-plan/","text/html; charset=UTF-8","200","OK","Indexable","","The transformer trap: Why your AI strategy needs an exit plan | Ten10","69","610","Learn how to future-proof your AI strategy with model-agnostic engineering, vendor independence, and resilient systems.","119","766","","0","The transformer trap: Why your AI strategy needs an exit plan","61","We’re not in an AI bubble—we’re in a transformer architecture bubble","68","The thought experiment no one wants to run","42","index, follow, max-image-preview:large, max-snippet:-1, max-video-preview:-1","","","https://ten10.com/blog/the-transformer-trap-why-your-ai-strategy-needs-an-exit-plan/","","","","","","130517","35278","35278","13.514","","2068","329","6.286","55.310","Fairly Hard","10.988","3","2","","20","5","0","1.170","78","35","0","7","5","0","","","","","c152eb2ee0c979cb55d482fdc9261bf0","0.295","","","","","en-GB","1.1","","","","","","https://ten10.com/blog/the-transformer-trap-why-your-ai-strategy-needs-an-exit-plan/","2026-02-03 09:56:01"
"https://ten10.com/category/whitepapers/","text/html; charset=UTF-8","200","OK","Indexable","","Whitepapers Archives | Ten10","28","262","Read the latest findings from our tech industry whitepapers and hear expert insights you can apply to your organisation, straight from our consultancy team.","156","985","","0","Whitepapers","11","","0","","0","index, follow, max-image-preview:large, max-snippet:-1, max-video-preview:-1","","","https://ten10.com/category/whitepapers/","","","","","","114858","27585","27585","10.567","","599","104","5.760","43.794","Hard","4.272","3","2","","32","10","0","2.350","88","35","0","7","5","0","","","","","69589b210937d32e3f5b714d1869f3d9","0.012","","","","","en-GB","1.1","","","","","","https://ten10.com/category/whitepapers/","2026-02-03 09:56:01"
"https://ten10.com/blog/data-integrity-and-its-importance-in-the-ai-driven-sdlc/","text/html; charset=UTF-8","200","OK","Indexable","","Data integrity and its importance in the AI-driven SDLC | Ten10","63","547","Learn the critical role data integrity plays in AI-driven quality engineering and software testing, including best practices you must follow.","141","854","","0","Data integrity and its importance in the AI-driven SDLC","55","Why is data integrity important in AI?","38","Key components of data integrity","32","index, follow, max-image-preview:large, max-snippet:-1, max-video-preview:-1","","","https://ten10.com/blog/data-integrity-and-its-importance-in-the-ai-driven-sdlc/","","","","","","132233","35508","35508","13.602","","1921","299","6.425","42.961","Hard","10.238","3","2","","23","5","0","1.170","86","38","0","8","6","0","","","","","5628a4ed05554dec436112fc35df7849","0.317","","","","","en-GB","1.1","","","","","","https://ten10.com/blog/data-integrity-and-its-importance-in-the-ai-driven-sdlc/","2026-02-03 09:56:01"
"https://ten10.com/case-studies/compatibility-testing-of-html-email-templates/","text/html; charset=UTF-8","200","OK","Indexable","","Compatibility testing of HTML email templates | Ten10","53","482","Read how our Digital Test Lab helped an international law firm create a compatibility testing methodology and conducted critical compatibility testing.","151","946","","0","Compatibility testing of HTML email templates","45","The Project","11","What we did","11","index, follow, max-image-preview:large, max-snippet:-1, max-video-preview:-1","","","https://ten10.com/case-studies/compatibility-testing-of-html-email-templates/","","","","","","124573","31935","31935","12.234","","1271","189","6.725","53.307","Fairly Hard","7.315","3","2","","23","7","0","1.640","80","37","0","7","5","0","","","","","b2718e74631acf92cca9143daccfc1b9","0.308","","","","","en-GB","1.1","","","","","","https://ten10.com/case-studies/compatibility-testing-of-html-email-templates/","2026-02-03 09:56:01"
"https://ten10.com/blog/meet-our-academy-consultants-benjamin-kerridge/","text/html; charset=UTF-8","200","OK","Indexable","","Meet our Academy Consultants - Benjamin Kerridge | Ten10","56","526","Meet Ben Kerridge, a business finance management graduate who was looking for a fulfilling career path when he found the Ten10 Academy.","135","897","","0","Meet our Academy Consultants – Benjamin Kerridge","48","Read how Ben transitioned from business finance to business analysis by joining the Ten10 Academy","97","Find talent like Ben to grow your tech team","43","index, follow, max-image-preview:large, max-snippet:-1, max-video-preview:-1","","","https://ten10.com/blog/meet-our-academy-consultants-benjamin-kerridge/","","","","","","126915","33850","33850","12.967","","1813","255","7.110","64.109","Normal","9.316","3","2","","21","6","0","1.410","80","35","0","7","5","0","","","","","e8740289703b2d29518b166b2bebfed4","0.312","","","","","en-GB","1.1","","","","","","https://ten10.com/blog/meet-our-academy-consultants-benjamin-kerridge/","2026-02-03 09:56:01"
"https://ten10.com/category/podcast/page/3/","text/html; charset=UTF-8","200","OK","Indexable","","Podcast Archives | Page 3 of 3 | Ten10","38","340","Hear the latest insights and expert advice straight from our consultants by listening to the Ten Minutes with Ten10 podcast.","124","782","","0","Podcast","7","Posts pagination","16","","0","index, follow, max-image-preview:large, max-snippet:-1, max-video-preview:-1","","","https://ten10.com/category/podcast/page/3/","","https://ten10.com/category/podcast/page/2/","","","","108580","27334","27334","10.471","","569","96","5.927","48.569","Hard","4.280","3","4","","18","3","0","0.700","83","34","0","7","5","0","","","","","69ccc34de862edbff9417711a1040ba5","0.021","","","","","en-GB","1.1","","","","","","https://ten10.com/category/podcast/page/3/","2026-02-03 09:56:01"
"https://ten10.com/blog/what-is-software-testing/","text/html; charset=UTF-8","200","OK","Indexable","","What is software testing? Types, levels and when to automate | Ten10","68","617","Make sense of software testing. Learn key approaches, best practices, and how Ten10 helps teams launch quality software with confidence.","136","890","","0","What is software testing?","25","In this guide","13","Why software testing matters","28","index, follow, max-image-preview:large, max-snippet:-1, max-video-preview:-1","","","https://ten10.com/blog/what-is-software-testing/","","","","","","150296","39485","39485","15.126","","2984","490","6.090","46.452","Hard","14.031","3","2","","45","12","0","2.820","109","41","0","7","5","0","","","","","d6df2e8ef9d377e8fd8429c6e63a00","0.019","","","","","en-GB","1.1","","","","","","https://ten10.com/blog/what-is-software-testing/","2026-02-03 09:56:01"
"https://ten10.com/blog/specialists-in-3e-quality-engineering-and-software-testing/","text/html; charset=UTF-8","200","OK","Indexable","","Ten10 Legal - Specialists in 3E Quality Engineering | Ten10","59","514","Read how we support legal practices across the country, delivering 3E quality engineering and software testing services.","120","759","","0","Ten10 Legal – Specialists in 3E Quality Engineering and Software Testing","72","Who we are","10","Ten10 Legal – Experts in 3E Implementations, Upgrades and Integrations","70","index, follow, max-image-preview:large, max-snippet:-1, max-video-preview:-1","","","https://ten10.com/blog/specialists-in-3e-quality-engineering-and-software-testing/","","","","","","128058","33574","33574","12.862","","1614","220","7.336","46.176","Hard","9.028","3","2","","20","5","0","1.170","84","38","0","7","5","0","","","","","e2402e226e85202850408314793f46f6","0.344","","","","","en-GB","1.1","","","","","","https://ten10.com/blog/specialists-in-3e-quality-engineering-and-software-testing/","2026-02-03 09:56:01"
"https://ten10.com/blog/meet-our-academy-consultants-daniel-anderson/","text/html; charset=UTF-8","200","OK","Indexable","","Meet our Academy Consultants - Daniel Anderson | Ten10","54","509","Read how Daniel transitioned from training at the Ten10 Academy to spending his first year in tech as part of a Data Services team.","131","829","","0","Meet our Academy Consultants – Daniel Anderson","46","Read how Daniel transitioned from training at the Ten10 Academy to working in Data Services as we interview him after his first year working in tech","148","Grow your tech team with the right talent, right now","52","index, follow, max-image-preview:large, max-snippet:-1, max-video-preview:-1","","","https://ten10.com/blog/meet-our-academy-consultants-daniel-anderson/","","","","","","125304","32969","32969","12.630","","1701","230","7.396","65.540","Normal","8.990","3","2","","21","6","0","1.410","79","35","0","7","5","0","","","","","e8039f1099f1ed40a2783062c635f133","0.325","","","","","en-GB","1.1","","","","","","https://ten10.com/blog/meet-our-academy-consultants-daniel-anderson/","2026-02-03 09:56:01"
"https://ten10.com/consultancy/software-testing-quality-assurance-services/functional-non-functional-testing/","text/html; charset=UTF-8","200","OK","Indexable","","Funtional and Non-Functional Testing Services | Ten10","53","483","Learn more about efficient, highly effective Functional and Non-Functional testing services across multiple testing levels, methodologies and industries.","153","958","","0","Functional andNon-Functional Testing Services","45","Efficient and highly effective testing services across multiple testing levels, methodologies and industries","108","Functional Testing","18","index, follow, max-image-preview:large, max-snippet:-1, max-video-preview:-1","","","https://ten10.com/consultancy/software-testing-quality-assurance-services/functional-non-functional-testing/","","","","","","136411","36140","36140","13.845","","1001","152","6.586","42.529","Hard","5.634","3","3","","17","2","0","0.470","75","32","0","7","5","0","","","","","75abd27bb3a3674ec52bcb37e1ecdb4","0.357","","","","","en-GB","1.1","","","","","","https://ten10.com/consultancy/software-testing-quality-assurance-services/functional-non-functional-testing/","2026-02-03 09:56:02"
"https://ten10.com/blog/accelerate-your-business-with-automated-data-processing/","text/html; charset=UTF-8","200","OK","Indexable","","Accelerate your business with automated data processing | Ten10","63","583","Understand how Automated Data Processing (ADP) can revolutionise how your organisation uses data to drive new, innovative solutions.","132","866","","0","Accelerate your business with automated data processing","55","What data can you automate?","27","People also ask","15","index, follow, max-image-preview:large, max-snippet:-1, max-video-preview:-1","","","https://ten10.com/blog/accelerate-your-business-with-automated-data-processing/","","","","","","137130","37073","37073","14.202","","2548","413","6.169","39.607","Hard","13.331","3","2","","21","6","0","1.410","86","38","0","7","5","0","","","","","ec7861438625d94534835799c0cc2cb1","0.323","","","","","en-GB","1.1","","","","","","https://ten10.com/blog/accelerate-your-business-with-automated-data-processing/","2026-02-03 09:56:02"
"https://ten10.com/blog/meet-our-academy-consultants-lana-aldridge/","text/html; charset=UTF-8","200","OK","Indexable","","Meet our Academy Consultants - Lana Aldridge | Ten10","52","486","Read how Lana found her career path with no coding experience and became a System Tester through our Ten10 Academy.","115","786","","0","Meet our Academy Consultants – Lana Aldridge","44","Read how Lana found her career path to become a System Tester through our Ten10 Academy","87","Grow your tech team with the right talent, right now","52","index, follow, max-image-preview:large, max-snippet:-1, max-video-preview:-1","","","https://ten10.com/blog/meet-our-academy-consultants-lana-aldridge/","","","","","","126453","33818","33818","12.955","","1829","254","7.201","63.260","Normal","9.473","3","2","","21","6","0","1.410","80","36","0","7","5","0","","","","","8d508a89492b1cadf410858e3e3a90e6","0.330","","","","","en-GB","1.1","","","","","","https://ten10.com/blog/meet-our-academy-consultants-lana-aldridge/","2026-02-03 09:56:02"
"https://ten10.com/blog/ai-search-and-content-in-2025/","text/html; charset=UTF-8","200","OK","Indexable","","AI, search, and content in 2025 | Ten10","39","342","Ash Gawthorp discusses the impact AI is making on SEO and how testing is the foundation of an AI-ready content strategy.","120","776","","0","AI, search, and content in 2025: What content creators and enterprises need to know","83","Ash Gawthorp, Ten10’s Chief Technology Officer, considers the impact AI is making on SEO, with the rise of A2A communications and how testing is the foundation of an AI-ready content strategy","191","The new search paradigm: AI’s impact","36","index, follow, max-image-preview:large, max-snippet:-1, max-video-preview:-1","","","https://ten10.com/blog/ai-search-and-content-in-2025/","","","","","","137880","37778","37778","14.472","","2668","481","5.547","27.946","Very Hard","14.930","3","2","","20","5","0","1.170","78","35","0","7","5","0","","","","","f5dbec77e7918376d3bf3aca34c7de41","0.452","","","","","en-GB","1.1","","","","","","https://ten10.com/blog/ai-search-and-content-in-2025/","2026-02-03 09:56:02"
"https://ten10.com/category/case-studies/page/4/","text/html; charset=UTF-8","200","OK","Indexable","","Case Studies Archives | Page 4 of 5 | Ten10","43","382","Read how we've helped organisations around the world deliver complex projects and bring solutions to life with our expert consultancy team.","139","888","","0","Case Studies","12","Posts pagination","16","","0","index, follow, max-image-preview:large, max-snippet:-1, max-video-preview:-1","","","https://ten10.com/category/case-studies/page/4/","https://ten10.com/category/case-studies/page/5/","https://ten10.com/category/case-studies/page/3/","","","","121048","28764","28764","11.019","","652","108","6.037","43.185","Hard","4.397","4","4","","19","3","0","0.700","100","40","0","7","5","0","","","","","409ee6aee871cb630264beded896dbf7","0.486","","","","","en-GB","1.1","","","","","","https://ten10.com/category/case-studies/page/4/","2026-02-03 09:56:02"
"https://ten10.com/case-studies/agile-transformation-in-a-multi-vendor-environment-for-a-uk-retailer/","text/html; charset=UTF-8","200","OK","Indexable","","Agile transformation in a multi-vendor environment | Ten10","58","519","Read our case study of how we initiated the transition from Waterfall to Agile and established an Agile best practice model for future deliveries.","146","902","","0","Agile transformation in a multi-vendor environment for a UK retailer","68","How you can achieve the same results","36","Latest Insights","15","index, follow, max-image-preview:large, max-snippet:-1, max-video-preview:-1","","","https://ten10.com/case-studies/agile-transformation-in-a-multi-vendor-environment-for-a-uk-retailer/","","","","","","128042","33024","33024","12.651","","1533","221","6.937","48.530","Hard","8.645","4","2","","23","8","0","1.880","81","36","0","7","5","0","","","","","cb66503f42e54e1ba6ccccfc539a5902","0.499","","","","","en-GB","1.1","","","","","","https://ten10.com/case-studies/agile-transformation-in-a-multi-vendor-environment-for-a-uk-retailer/","2026-02-03 09:56:02"
"https://ten10.com/blog/how-we-help-digital-retailers-stay-competitive/","text/html; charset=UTF-8","200","OK","Indexable","","How we help digital retailers stay competitive | Ten10","54","470","Read about the important roles our consultants play in bringing tech solutions to life for digital retailers across the globe.","126","757","","0","How we help digital retailers stay competitive","46","From accelerating your digital transformation to helping you grow your tech team, we can support your business whatever your goals and priorities","145","Successful Salesforce eCommerce migration for Hobbycraft","56","index, follow, max-image-preview:large, max-snippet:-1, max-video-preview:-1","","","https://ten10.com/blog/how-we-help-digital-retailers-stay-competitive/","","","","","","130395","34623","34623","13.263","","1793","251","7.143","52.844","Fairly Hard","9.555","3","2","","20","5","0","1.170","85","38","0","8","6","0","","","","","7245b85400ec15a3420f02836a9b738e","0.551","","","","","en-GB","1.1","","","","","","https://ten10.com/blog/how-we-help-digital-retailers-stay-competitive/","2026-02-03 09:56:02"
"https://ten10.com/podcast/ten-minutes-with-ten10-why-is-accessibility-overlooked/","text/html; charset=UTF-8","200","OK","Indexable","","Podcast: Why is accessibility overlooked? | Ten10","49","438","Learn why accessibility must become a priority in your organisation with this bite-sized podcast from our expert accessibility consultant.","138","858","","0","Why is accessibility overlooked?","32","Learn why accessibility must become a priority in your organisation","67","Make it easy for everyone to buy from you","41","index, follow, max-image-preview:large, max-snippet:-1, max-video-preview:-1","","","https://ten10.com/podcast/ten-minutes-with-ten10-why-is-accessibility-overlooked/","","","","","","127081","33697","33697","12.909","","2053","275","7.465","68.917","Normal","10.197","4","2","","21","5","0","1.170","80","36","0","8","6","0","","","","","191fefb9afc25ac1324dfbfd678a28dc","0.015","","","","","en-GB","1.1","","","","","","https://ten10.com/podcast/ten-minutes-with-ten10-why-is-accessibility-overlooked/","2026-02-03 09:56:03"
"https://ten10.com/whitepapers/performance-testing-in-non-representative-environments-10-key-factors-for-consideration/","text/html; charset=UTF-8","200","OK","Indexable","","Performance testing in non-representative environments | Ten10","62","567","Download our free expert whitepaper explaining 10 key factors you must consider when conducting performance testing in non-representative environments.","151","995","","0","Performance testing in non-representative environments – 10 key factors for consideration","89","What is a non-representative environment?","41","1. Using non-representative environments to left-shift performance testing","74","index, follow, max-image-preview:large, max-snippet:-1, max-video-preview:-1","","","https://ten10.com/whitepapers/performance-testing-in-non-representative-environments-10-key-factors-for-consideration/","","","","","","142004","39483","39483","15.125","","4149","515","8.056","55.660","Fairly Hard","19.055","4","2","","22","6","0","1.410","81","38","0","7","5","0","","","","","ea6a4de1a224194c76a1bb55dd4cc68d","0.012","","","","","en-GB","1.1","","","","","","https://ten10.com/whitepapers/performance-testing-in-non-representative-environments-10-key-factors-for-consideration/","2026-02-03 09:56:03"
"https://ten10.com/blog/devops-on-legacy-infrastructure/","text/html; charset=UTF-8","200","OK","Indexable","","DevOps on legacy infrastructure | Ten10","39","353","Learn how ways of delivery can affect your organisation, including the 'Happy Path' or different tech stacks, and how our experience can help you.","146","918","","0","DevOps on legacy infrastructure","31","Working On The Happy Path","25","Experience","10","index, follow, max-image-preview:large, max-snippet:-1, max-video-preview:-1","","","https://ten10.com/blog/devops-on-legacy-infrastructure/","","","","","","120732","31630","31630","12.117","","1328","181","7.337","60.448","Normal","7.532","4","2","","20","5","0","1.170","83","37","0","7","5","0","","","","","a0a8c8b2924b1b1be9211673c77a5314","0.407","","","","","en-GB","1.1","","","","","","https://ten10.com/blog/devops-on-legacy-infrastructure/","2026-02-03 09:56:02"
